rank,title,id,marked_as_amazon,is_ad,rating,review_count
0,"Amazon Basics Pounding Bench With Xylophone and Shape Sorter-kids Gift For Age 18M+, Boy Girl Baby, Multicolor",B09XVC8B33,True,False,4.9,86
1,Unisex Babies' Plush Playset,B0BM576292,True,False,4.4,56
2,"Amazon Basics Toy Construction Vehicle Set, Dump Truck and Bulldozer, Indoor/Outdoor, 10-Inch, Pack of 2, Yellow, 10.25"" x 12"" x 5.75""",B08M19TRW8,True,False,4.7,490
3,"Amazon Basics BPA Free Crush-Proof Plastic Pit Ball with Storage Bag, Toddlers Kids 12+ Months, Pack of 400 Balls, 6 Bright Colors",B08LZRB2MS,True,False,4.6,3691
4,"Amazon Basics 120-piece Train Set and Table-kids Gift for Age 3Y+, Multi, 47.4 x 33.46 x 16.14 inches",B08NWDQXLS,True,False,4.4,288
5,"Amazon Basics Kids Corner Wooden Kitchen Playset with Interactive Doors, Knobs, and Lights, White & Gray, Gift for Age 3Y+, 39.37"" x 28.35"" x 35.04''",B08P4HC1B1,True,False,4.3,1522
6,"Amazon Basics Kids Soft Play Corner Climber, 4-Piece",B07G7C4NXN,True,False,4.8,3516
7,Amazon.com eGift Card,B07J54KYP1,False,False,4.8,871041
8,Amazon.com Gift Card in a Greeting Card (Various Designs),B00CHQ6S56,False,False,4.8,71930
9,Amazon.com eGift Card,B07MB4HN9X,False,False,4.8,871041
10,"Amazon Basics Portable Foldable Photo Studio Box with LED Light, 1 Count (Pack of 1), Black, 25 x 30 x 25 Inches",B01GIL6EU4,True,False,4.6,3953
11,Amazon.com eGift Card,B01FIS88SY,False,False,4.8,871041
12,Amazon.com Gift Card in a Mini Envelope,B07Y93TM8M,False,False,4.9,108289
