rank,title,id,marked_as_amazon,is_ad,rating,review_count
0,"upsimples 4x6 Picture Frame Set of 10, Display Pictures 3.5x5 with Mat or 4x6 Without Mat, Multi Photo Frames Collage for Wall or Tabletop Display, Black",B09652HXBG,False,False,4.7,20467.0
1,"upsimples 4x6 Picture Frame Set of 3, Made of High Definition Glass for 4x 6 Black Frames, Wall and Tabletop Display Thin Border Photo Frame for Home Décor",B0C8J18P5S,False,False,4.3,17.0
2,"HappyHapi 4x6 Inch Picture Frames,Set of 10 Wooden Picture Frames, Tabletop or Wall Display Decoration for Photos, Paintings, Landscapes, Posters, Artwork (Black)",B088LY5W9P,False,False,4.5,1667.0
3,"HappyHapi 4x6 Picture Frame, 2 Pack Wooden Black Picture Frames, Tabletop or Wall Display Decoration Photo Frames for Photos, Paintings, Landscapes, Posters, Artwork",B0BCYVKK34,False,False,4.3,112.0
4,"4x6 Picture Frames Set of 2, Wooden Picture Frames with HD Plexiglass, Black Edging for Classic Style, Horizontal and Vertical for Wall and Tabletop",B0CDLY1QD1,False,False,,
5,HappyHapi 4x6 Picture Frame 2 Pack Photo Picture Frame with Real Glass for Wall or Tabletop Display Decor 4x6 Frames Collage for Photos/Artwork/Paintings (Black),B0BYHHY8ZP,False,False,4.5,113.0
6,"Icona Bay 4x6 Black Picture Frame, Modern Double-Beveled Frame, Tabletop or Wall Mount, Eve Collection",B09CGS9ZFJ,False,False,4.4,495.0
7,"Icona Bay 4x6 Transom Brown Picture Frame, Rustic Casual Style 4 x 6 Photo Frame, Table Top or Wall Mount, Chalet Collection",B08HMW1H37,False,False,4.7,390.0
8,Americanflat 4x6 Picture Frame in Black - Thin Border Photo Frame with Shatter Resistant Glass - Horizontal and Vertical Formats for Wall and Tabletop,B07T86DZSN,False,False,4.7,2722.0
9,"4x6 Silver Picture Frame, Distinguished Edging for Classic Style, Richland Collection",B08PP8Z667,False,False,4.4,351.0
10,"4x6 Picture Frames Set of 8, Rustic Picture Frames Multi Wood Pattern, HD Plastic Cover (Plexiglass) Display Photos 4x6 inch,Vertical and Horizontal Formats for Wall Hanging and Tabletop Display,Perfect for Rustic Home & Office Decor",B0BFW7RBDS,False,False,4.4,294.0
11,"Handicrafts Home Decorative Picture Frame Wooden Photo Frame and Collage (WHITE-0.75, 4x6)",B01KG94JNS,False,False,4.5,2077.0
12,4x6 Double Picture Frame Wooden Hinged Photo Frame Definition Glass Stand Vertically on Desktop or Tabletop Black,B098QD6D7S,False,False,4.6,1177.0
13,"4x6 Picture Frame Set of 2, Sparkle Glass Photo Frames 4 by 6 for Tabletop, Horizontally or Vertically",B0BZV11QP6,False,False,4.7,590.0
14,"PECULA 2 Pack 4x6 Picture Frame, White Picture Frame for Wall and Tabletop Display, Photo Picture Frame with Clear Display",B0B4S891J9,False,False,4.2,3310.0
15,"Mixoo Picture Frame 2 Pack - Rustic Wooden Photo Frames with Walnut Wood Base and High Definition Break Free Acrylic Glass Covers for Tabletop or Desktop Display (4x6 inch, Horizontal + Vertical)",B0815S1M2W,False,False,4.7,3817.0
16,"HappyHapi 4x6 Picture Frame,Set of 4 Wooden Black Picture Frames, Tabletop or Wall Display Decoration Photo Frames for Photos, Paintings, Landscapes, Posters, Artwork",B0BCYT8FJK,False,False,4.2,117.0
17,RPJC 4x6 Picture Frames Made of Solid Wood High Definition Glass for Table Top Display and Wall Mounting Photo Frame Black,B06Y2KX81J,False,False,4.6,24362.0
18,4x6 Inches Simple Rectangular Desktop Family Picture Photo Frame with Glass Front (Blue),B014PB63YG,False,False,4.4,1302.0
19,"Americanflat 8x14 Collage Picture Frame in Black - Displays Three 4x6 Frame Openings - Engineered Wood Panoramic Picture Frame with Shatter Resistant Glass, Hanging Hardware, and Easel",B00YHK9CPI,False,False,4.7,1740.0
20,"Truu Design, Decorative Weathered, 4 x 6 inches, Blue Distressed Wooden Look Picture Frame, 4"" x 6""",B07HFPYB54,False,False,4.6,1150.0
21,"4x6 Picture Frames,Wooden Picture Frame 2 Pack- Black Picture Photo Frame with High Difinition Acrylic Glass Covers Rustic Photo Frames for Wall or Tabletop Display (Vertical)",B08C4YYMQ1,False,False,4.7,359.0
22,Americanflat 4x6 Picture Frame 2 Pack in Black with Polished Plexiglass - Thin Border 4 X 6 Inch Photo Frames for Wall or Desk - in Horizontal or Vertical Format,B09ZJW9R5Q,False,False,4.6,516.0
23,"4x6 Picture Frame, Pack of 2 Photo Frame with Real Glass, Solid Wood Rustic Picture Frames 4x6 Display for Wall Decor (Vintage Walnut)",B07TCQKXQ9,False,False,4.6,7553.0
24,"Melannco 24 x 12 Inch 8 Opening Photo Collage Frame, Displays Four 4x6 and Four 6x4 Inch Photos, Black",B078WYPCZJ,False,False,4.4,5276.0
25,Mantello 4x6 Inch Front Loading Picture Frames Set of 12 Black - Art Wall Hanging Table Desk - Family Gallery Multi Photo Frame,B07PWYNF8J,False,False,4.6,3752.0
26,Lawrence Frames 712646 4x6 Silver Metal Natural Branch Design Picture Frame,B071GZS8H1,False,False,4.8,1673.0
27,"Snap 4x6 Clear Acrylic Self Standing Frame, Set of 12",B019ROONVQ,False,False,4.5,4634.0
28,Lawrence Frames 670046 4x6 Simply Gold Metal Picture Frame,B072NDDGCR,False,False,4.7,2102.0
29,"4x6 Picture Frames Set (Black, 6 Pack) Distinguished Edging for Classic Style, Richland Collection",B08761X17K,False,False,4.5,1518.0
30,"Icona Bay 4x6 Picture Frame, Purple Colored Solid Wood Scandinavian Style Frame for Photo, Pizzazz Collection",B07QT7766D,False,False,4.6,2961.0
31,"Mixoo 4x6 Picture Frame Rotating Photo Frame, Wooden Picture Frame 4 by 6 Horizontal Double-sided Frame Rustic Floating Frame for Tabletop",B0C7VNGX7Y,False,False,4.6,30.0
32,"4x6 Picture Frame Set of 15, Rustic Brown Wood Photo Frame 4 by 6 for Wall or Tabletop Display",B0C5WDX5WL,False,False,4.5,45.0
33,"MCS Format Picture Frames, Gallery Wall Frames, Black, 4 x 6, 12-Pack",B008JC329C,False,False,4.7,2584.0
34,4x6 inch Picture Frames Set of 4 Modern Style Frame with High Definition Tempered Glass Colorful Decotative Photo Frames for Wall Mount and Tabletop Display Family Wedding Gift,B0C1G7CK74,False,False,4.6,30.0
35,"Fixwal 8x14 Collage Picture Frame with Three Openings for Displaying 4x6 Pictures, Picture Frame Collage, Multi Picture Frames for Wall Decor",B0CBRQGSTZ,False,False,,
36,"Icona Bay 4x6 Azure Gray Picture Frame, Cape Cod Style 4 x 6 Photo Frame, Table Top or Wall Mount, Bayou Collection",B08HN6ZFSG,False,False,4.6,644.0
37,"5x7 Picture Frame Black Displays 4x6 Photo Frame with Mat or 5x7 Inch Without Mat,Made of Plexiglass, MDF Wood, Table Top Display and Wall Mounting, Ideal Gift to Family and Friends",B089KJR8JN,False,False,4.3,2654.0
38,"18 Pack 4x6 Picture Frame Black, 4 x 6 Photo Frames Bulk for Wall Hanging or Tabletop Display",B0BTZTQL3D,False,False,4.6,205.0
39,"4X6 Walnut Wooden Picture Frame,Brown Photo Frame with Double Side Acrylic Glass Cover, 2pcs Horizontal Vertical Photos for Table Top or Desktop Display, Gift for Family, Partner and Friends Gift",B0B3MT8LY1,False,False,4.5,216.0
40,"Giftgarden 4x6 Picture Frame Glass Modern 4 by 6 Photo Frames Friends Gifts for Tabletop Display, 2 Pack",B0149SXI84,False,False,4.7,4925.0
41,"Isaac Jacobs 4x6 Silver Wave Textured Hand-Crafted Resin Picture Frame with Easel & Hook for Tabletop & Wall Display, Decorative Swirl Design Home Décor, Photo Gallery, Art, More (4x6, Silver)",B079M9B65Q,False,False,4.8,922.0
42,"Icona Bay 4x6 Red Picture Frame, Modern Style Wood Composite Frame, Table Top or Wall Mount, Bliss Collection",B0B422TLTD,False,False,4.4,2511.0
43,"4x6 Picture Frames Set of 4, Colorful Photo Frame of Modern Style, High Definition Tempered Real Glass, Wall Mounted or Tabletop Display (Blue+Light Blue+Orange+Apricot)",B08FQX3L3T,False,False,4.7,1553.0
44,"Icona Bay 4x6 Hickory Brown Picture Frame, Contemporary Photo Frame 4 x 6, Composite Wood Frame for Walls or Tabletop, Lakeland Collection",B09CGXPTYQ,False,False,4.5,4109.0
45,4x6 Minimalist Picture Frame Acrylic Glass Photo Frame with Magnetic Desktop Display Horizontally or Vertically,B09632LZ75,False,False,4.6,826.0
46,"4x6 Picture Frame Distressed Farmhouse Wood Pattern Set of 4 with Tempered Glass,Display 3.5x5 Photos with Mat or 4x6 Without Mat, Horizontal and Vertical Formats for Wall and Table Mounting,Multicolour",B08Y5G95N4,False,False,4.7,1873.0
47,Lawrence Frames Blue Finish 4x6 Picture Frame - Gold Bead Design,B002RGYHP4,False,False,4.6,346.0
