rank,title,id,marked_as_amazon,is_ad,rating,review_count
0,"Amazon Basics Room Darkening Blackout Curtain Rod - 48"" to 88"", Black",B0792H4HFM,True,False,4.7,9740
1,"Byondeth Curtain Rods for Windows 16 to 144 Inches Adjustable Length 1 Inch Diameter Window Curtain Rod with Aluminium Finials, Black",B0B7WQVYGF,False,True,4.5,1245
2,"KAMANINA 1 Inch Single Curtain Rod 32 to 58 Inch(2.6-4.8Ft), Antique Bronze Adjustable Drapery Rod for Windows, Decorative Netted Texture End",B0C4DX5YDK,False,True,4.7,54
3,"Briofox Silver Curtain Rods for Windows 48 To 84 Inch, 1 Inch Heavy Duty Adjustable Curtain Rod With Modern Decorative End Cap Finials",B0C246LL1Y,False,True,4.7,342
4,"GXOACKJ Curtain Rods for windows 32 to 62 inch,5/8 inch Decorative Rod Set, Matte Black Splicing Heavy Duty Metal with Brackets",B0BJL7G2BT,False,False,4.3,1689
5,"Alskarhem Black Curtain Rods for Windows 30 to 88 Inch,5/8 Inch Small Curtain Rod Set With Brackets",B09XVNMPZ8,False,False,4.3,2337
6,"Byondeth Curtain Rods for Windows 16 to 144 Inches Adjustable Length 1 Inch Diameter Window Curtain Rod with Aluminium Finials, Black",B0B7WQVYGF,False,False,4.5,1245
7,"White Curtain Rods for Windows 28 to 50 Inch - 5/8” Heavy Duty Curtain Rods Set,Decorative Cafe Drapery Rods with Brackets - Matte Rustic",B0BN9V95YV,False,False,4.3,812
8,"Blu-Pier Tech Heavy Duty Single Rod,Lock Seam Curtain Rod 28 to 48-Inch Adjustable Width, 2 1/2-Inch Projection，Hardware Included,White(Pack of 2)",B0C7BB3JCV,False,False,4.3,733
9,"Thestoa Curtain Rods for Windows 32-48 inch, 5/8""Black Curtain Rods 2 pack, Stainless Steel Heavy Duty Curtain Rods for Bedroom, Living Room, Outdoor Curtain Rod Black",B0C3QW6M5M,False,False,4.5,63
10,"Amazon Basics 1-Inch Curtain Rod with Round Finials, 1-Pack, 36"" to 72"", Nickel",B01N49MX45,True,False,4.7,61263
11,"KAMANINA 1 Inch Curtain Rod Single Drapery Rod 72 to 144 Inches (6-12 Feet), Bronze Curtain Rods for Windows, Marbled Finials",B07D5BRPC2,False,True,4.7,4500
12,"KAMANINA 1 Inch Curtain Rod Single Drapery Rod 72 to 144 Inches (6-12 Feet), Black Curtain Rods for Windows, Twisted Cage Finials",B07D5BH91T,False,True,4.8,5232
13,"KAMANINA 1 Inch Curtain Rod Telescoping Single Drapery Rod 72 to 144 Inches (6-12 Feet), Bronze Curtain Rods for Windows, Round Finials",B07D5B3J3K,False,True,4.7,4361
14,"IFELS Heavy Duty Curtain Rods for Windows 66 to 120 Inch, 1 Inch Gold Curtain Rods for Outdoor Patio, Farmhouse, Bedroom, Kitchen, Living Room, Adjustable Easy Install Curtain Rods (Gold,30""-120""-1Pack)",B0C598G7ZR,False,False,4.6,46
15,"Bronze Window Curtain Rods 30 to 88 Inches, Decorative 5/8 Inch Diameter Single Window Curtain Rod Set for Room Divider, Bedroom, Living room, Kitchen, Bathroom,With Brackets",B0BLLG7NRH,False,False,4.3,398
16,"Wood Curtain Rods for Windows: 1 Inch Diameter Adjustable Drapery Rods 16"" to 28"", Decorative Window Curtain Rods with Imitation Wood Grain Leaf Pattern Finials,Heavy Duty Single Curtain Rods for Bedroom Kitchen Window Office",B0C2CFRC4K,False,False,4.8,472
17,"SMODBRODRE Curtain Rods for window 32 to 48, Nickel 5/8 inch Splicing Curtain Rods, Single Window Curtain Rod Set with Brackets, Decorative Blackout Metal Curtain Rods",B0BYJH169C,False,False,4.5,155
18,"KAMANINA 1 Inch Curtain Rod 32 to 58 Inches (2.6-4.8ft), Antique Silver Single Drapery Rods for Windows, Square Finials",B0C1NTSZG9,False,True,4.7,1009
19,"BRIOFOX Curtain Rod Set 1 Inch Adjustable 72 to 144 Inches, Long Decorative Drapery Treatment Single Window Curtain Rods, Imitation Wood Grain 1 Pack",B093T5Y69C,False,True,4.7,1394
20,"KAMANINA 1 Inch Curtain Rod 30 to 59 Inch(2.5-4.9ft) Antique Silver Single Curtain Rods for Windows, Splicing Adjustable Drapery Rod with Cap End",B0BD565L56,False,True,4.6,402
21,"KAMANINA 1 Inch Double Curtain Rods 72 to 144 Inches (6-12 Feet) Telescoping Drapery Rod for Windows 69 to 140 Inches, Netted Texture Finials, Antique Bronze",B095Y66LV6,False,True,4.7,1688
22,"CALCHELE Black Curtain Rods for Windows 48 to 84”, 5/8 Inch Window Curtain Rod 2 Pack, Heavy Duty Drapery Rods with Brackets, Rustic Matte",B0C6KJMQLT,False,False,4.4,30
23,"USFOOK 1 Inch Curtain Rods 32 to 58 Inches (2.6-4.8ft), Telescoping Splicing Drapery Rods for Windows, Silver Decorative Translucent Finials",B0C5H5YYGM,False,False,4.6,198
24,"Zeerobee Curtain Rods for Windows 48 to 84, 1 Inch Industrial Curtain Rod, Wrap Around Black Curtain Rods, Indoor/Outdoor Curtain Rod, Room Divider Curtain Rod, Adjustable Curtain Rod, 48-86""",B0B8GJC25M,False,False,4.6,952
25,"BRIOFOX Curtain Rods,Long Adjustable Curtain Rod for Windows 72 to 144 inch,1 Inch Thicken Single Curtain Rods,with Decortive Square Finials Drapery Rods,Antique Bronze",B0BB22VM83,False,False,4.8,520
26,"YeYeBest Curtain Rod - 28"" to 48"" for Windows Small Curtain Rod Set - Modern Simplicity Décor Style 5/8 Inch Metal Pole - Heavy Duty Drapery Rods with Brackets - Black",B0BTSZ4TNJ,False,False,4.4,332
27,"Amazon Basics Room Darkening Blackout Curtain Rod - 48"" to 88"", Black",B0792H4HFM,True,False,4.7,9740
28,"Kenney KN71608 Chelsea Ball End Standard Decorative Window Curtain Rod, 28-48"" Adjustable Length, Brushed Nickel Finish, 5/8"" Diameter Steel Tube",B009U20GXK,False,False,4.6,5173
29,"2 Pack Wrap Around Curtain Rods for Windows 48 to 84 Inches, Blackout Curved Curtain Rod, for Indoor and Outdoor, Adjustable from 48 to 86 Inches, Black",B0BNX8DBVB,False,False,4.7,328
30,"Standard Decorative Window Curtain Rods 30 to 45 Inch,5/8 Inch Diameter Small Curtain Rod Set, Heavy Duty Drapery Rods with Brackets-Black",B09QPMRGXG,False,False,4.3,3692
31,"HOME COMPOSER Curtain Rods - Sturdy Black Curtain Rods for Windows 48 to 84 inches - 1"" Diameter Decorative Adjustable Blackout Curtain Rod for Sliding Door, Bedroom, Living Room...",B08VJ2H357,False,False,4.6,1934
32,"Zeerobee Curtain Rods for Windows 66 to 120, 1 Inch Black Curtain Rod Set, Heavy Duty Drapery Rods with Adjustable Curtain Rods, Outdoor Modern Curtain Rod with Simple End Caps, 32""-120"", Black",B0BJKKVXQG,False,False,4.5,729
33,Yafa Home Fashion Heavy Duty Single Standard Adjustable Curtain Rod Hardware Included White,B09Z4GSKTW,False,False,4.2,2820
34,"Amazon Basics 1-Inch Curtain Rod with Round Finials, 1-Pack, 72"" to 144"", Nickel",B01N1O0MRB,True,False,4.7,61263
35,"2 Pack Wrap Around Curtain Rods for Windows 66 to 120 Inches, Blackout Curved Curtain Rod, for Indoor and Outdoor, Adjustable from 65 to 120 Inches, Black",B0CB3MJ4C8,False,False,3.8,5
36,"KAMANINA 1 Inch Curtain Rods 32 to 58 Inches (2.6-4.8ft), Antique Bronze Single Curtain Rod for Windows, Decorative Drapery Rod with Marble End",B0C4DWT31L,False,False,4.7,4500
37,"Rustic Curtain Rod, Industrial Curtain Rods for Windows 48 to 84 Inches, Blackout Wrap Around Curtain Rod, for Indoor and Outdoor, Simple Modern Design, 48 to 86 Inches, Black",B09Q33RM8R,False,False,4.7,1819
38,"Rod Desyne 100-02-663-D Blossom Double Curtain Rod, 66 by 120-Inch, Light Gold",B00H3JOSAO,False,False,4.5,163
39,"Curtain Rods for Windows 32 to 52 Inch - 1 Inch Heavy Duty Black Curtain Rods with Brackets - Adjustable Window Curtains Rod for Door, Bedroom, Drapery, Valance, Kitchen, Bathroom",B097QRK39V,False,False,4.5,867
40,Ivilon Drapery Window Curtain Rod - End Cap Style Design 1 Inch Pole. 72 to 144 Inch Color Warm Gold,B06X9PHLSL,False,False,4.8,8970
41,"KAMANINA Antique Silver Curtain Rod 32 to 58 inch(2.6-4.8ft), 1 inch Adjustable Single Curtain Rods for Windows, Decorative Drapery Rod with Twisted Cage Finials",B0C4DQDYS4,False,False,4.8,5232
42,"KAMANINA 1 Inch Single Curtain Rod 32 to 58 Inch(2.6-4.8Ft), Antique Bronze Adjustable Drapery Rod for Windows, Decorative Netted Texture End",B0C4DX5YDK,False,False,4.7,54
43,"Curtain Rods, Curtain Rods for Windows 66 to 120, Black Curtain Rod, Outdoor Curtain Rod, 1 Inch Curtain Rods, Hanging Curtain Rod with Brackets, Rustic Curtain Rod, Curtain Rod Set",B09NKSKZNH,False,False,4.6,709
44,HOSKO 1-Inch Window Curtain Rods Set - Curtain Rods for Windows 30-84 Inches - Including Three Mounting Brackets (Black),B08R5Q8XTD,False,False,4.5,3566
45,"Curtain Rods for Windows 16 to 45 inch,3/4 inch Heavy Duty Adjustable Decorative Curtain Rods with Modern Finials,Window Curtain Rods for Bedroom, Living Room,Patio and Kitchen",B0C6P4K53N,False,False,4.0,6
46,"Gold Curtain Rods 28 to 48 Inch(2.3-4ft),1 Inch Diameter Heavy Duty Adjustable Modern Decorative Telescoping Window Drapery Rods, 18-45"",Brass Gold",B0BK56T6GB,False,False,4.3,453
47,"VOIIY Curtain Rods for Windows 48 to 84 Inch(4-7 Feet),Black 1'' Diameter Drapery Rods with End Cap Style Design,Modern Adjustable Heavy Duty Curtain Rod,Size:36''-88''",B0BY2LTXLY,False,False,4.5,515
48,"Kenney KN75796 Seville Square End Standard Decorative Window Curtain Rod, 48-86"" Adjustable Length, Matte Black Finish, 5/8"" Diameter Steel Tube",B009U1ZP0A,False,False,4.7,3908
49,"KAMANINA 1 Inch Curtain Rod Telescoping Single Drapery Rod 72 to 144 Inches (6-12 Feet), Ivory White Curtain Rods for Windows 69 to 140 Inches, Netted Texture Finials",B08HVMPVHN,False,False,4.7,21621
50,"UIOSANRT Wrap Around Curtain Rods for Windows 32 to 46 Inch,5/8 Inch Small Diameter Adjustable Heavy Duty Curtain Rod With Brackets,Room darkening,Fits Indoor and Outdoor,Black.",B0BB9RW36V,False,False,4.2,247
51,"Blackout Curtain Rods for windows 32 to 60 inch,5/8 inch Diameter Metal Single Curtain Rod Set,Drapery Rods for Room Divider, Bedroom, Living room, Kitchen, Bathroom,Outdoor",B0BHD3WFKY,False,False,4.4,142
52,"HOTOZON 2 Pack Antique Bronze Curtain Rod 32 to 86 Inch, 3/4 Inch Splicing Window Rods for window 20 to 82 Inches, Single Drapery Rod with Netted Ends",B0C89TTMLW,False,False,4.8,45
53,"2 Pack Modern Curtain Rod, End Cap Style Design, Curtain Rods for Windows 66 to 120 Inch, for Indoor and Outdoor, Adjustable from 95 to 150 Inches, Black",B0CB3K3T3J,False,False,3.0,3
54,"Kenney KN71717 Kendall Knob End Standard Decorative Window Curtain Rod, 48-86"" Adjustable Length, Brushed Nickel Finish, 5/8"" Diameter Steel Tube",B076CG9ZRK,False,False,4.7,20076
55,"IFELS Heavy Duty Curtain Rods for Windows 66 to 120 Inch, 1 Inch Diameter Premium Quality Adjustable Rod Set with Easy Installation and Modern Design (A1Black,66-120)",B0C5BYHFW9,False,False,4.5,36
56,"Black Curtain Rods for Windows 66 to 144"" - Long Curtain Rods for Grommet Drapes,1 inch Curtain Rod Set Heavy Duty for Sliding Door,Bedroom,Patio Door (3 Brackets)",B09968JWTP,False,False,4.6,1673
57,"Curtain Rods for Windows 48 to 84 inch Easy Install, Adjustable Splicing Curtain Rods 1"" Diameter, Heavy Duty Metal Drapery Rods, Ball Cage Finials, Black",B0B68G6MBD,False,False,4.5,136
58,Ivilon Drapery Window Curtain Rod - End Cap Style Design 1 Inch Pole. 48 to 86 Inch Color Black,B06WWPJX59,False,False,4.8,12953
59,"KAMANINA 3/4 Inch Curtain Rods for Windows, Splicing Adjustable Single Drapery Rod 32 to 58 Inches (2.6-4.8ft), Twisted Cage Finial,Antique Bronze",B0BTHMJCTF,False,False,4.5,257
