rank,title,id,marked_as_amazon,is_ad,rating,review_count
0,"Gooamp 100ML Ceramic Diffuser,Aromatherapy Diffuser,Essential Oil Diffuser with 7 Color Lights Auto Shut Off for Home Office Room,Wood Grain Base (0.5/1/2/ON hrs Working time)",B0BJKMWDBS,False,True,4.4,344
1,"Katusie 500ML Essential Oil Diffuser with 10 Essential Oils Gift Set, Aromatherapy Diffuser Humidifier with 2 Mist Mode 4 Timers＆ 7 Ambient Light Waterless Auto Off for Large Room Home Office",B097T2K8Q1,False,True,4.3,2049
2,"ASAKUKI 500ml Premium, Essential Oil Diffuser with Remote Control, 5 in 1 Ultrasonic Aromatherapy Fragrant Oil Humidifier Vaporizer, Timer and Auto-Off Safety Switch",B01MR4Y0CZ,False,True,4.5,50367
3,"ASAKUKI 300ML Essential Oil Diffuser, Quiet 5-in-1 Premium Humidifier, Natural Home Fragrance Aroma Diffuser with 7 LED Color Changing Light and Auto-Off Safety Switch",B07LBQR3QY,False,True,4.3,10953
4,"ASAKUKI 500ml Premium, Essential Oil Diffuser with Remote Control, 5 in 1 Ultrasonic Aromatherapy Fragrant Oil Humidifier Vaporizer, Timer and Auto-Off Safety Switch",B01MR4Y0CZ,False,False,4.5,50367
5,"Dukya Essential Oil Diffuser, 110ml Colorful Aromatherapy Diffuser with 8 Colors Lights, Adjustable Mist Mode, Waterless Auto Off for Home Office Room, Basic White",B0B4WR6SJZ,False,False,4.5,1695
6,"Himalayan Salt lamp Diffuser, 2-in-1 Salt Lamp & Ultrasonic Essential Oil Aromatherapy Diffuser, 220ml Tank Oil Diffuser Waterless Auto-Off, Salt Rock Lamp for Home Office Room",B0C1SL94T1,False,False,3.8,33
7,"ASAKUKI 300ML Essential Oil Diffuser, Quiet 5-in-1 Premium Humidifier, Natural Home Fragrance Aroma Diffuser with 7 LED Color Changing Light and Auto-Off Safety Switch",B07LBQR3QY,False,False,4.3,10953
8,"YIKUBEE Essential Oil Diffusers, 500ml Diffusers for Essential Oils Large Room,Home, Aromatherapy Oil Diffuser with Cool Mist",B09TFH65FK,False,False,4.3,7267
9,"Essential Oil Diffusers,Aromatherapy Diffuser for Home Bedroom, Grass Plants Raining Artificial Night Light -Humidifiers for Bedroom Fountain Bedside Sleeping Relaxing Mood Water Drop Sound",B0C23DT8NP,False,False,4.1,74
10,"Colorful Flame Air Aroma Diffuser Humidifier, Upgraded 7 Flame Colors Noiseless Essential Oil Diffuser for Home,Office,Yoga with Auto-Off Protection 180ml (8Hours Black)",B0B4NN6ZK2,False,True,4.1,1202
11,COCODOR Preserved Flower Reed Diffuser/White Jasmine/6.7oz(200ml)/1 Pack/Home & Office Decor Aromatherapy Diffuser Oil Gift Set,B0848JGM78,False,True,4.2,14252
12,"Humidifiers for Bedroom, Esemoil 2.5L Cool Mist Ultrasonic Air Humidifier with Top Fill & Quiet, 360° Nozzle, BPA Free, 25 Hour Diffuser with 8 Color Light & Auto Shut-off for Home Baby Nursery Plants",B0C9ZDZG7P,False,True,5.0,9
13,"InnoGear Oil Diffuser, Aromatherapy Diffuser for Essential Oils 150ml Scent Diffuser Ultrasonic Cool Mist Humidifier with 2 Mist Modes 7 Color Lights Waterless Auto Off for Room Office, Shiny Silver",B0C7GR5XX9,False,True,4.4,49
14,"InnoGear Essential Oil Diffuser, Upgraded Diffusers for Essential Oils Aromatherapy Diffuser Cool Mist Humidifier with 7 Colors LED Lights 2 Mist Mode Waterless Auto Off for Home Office Room, White",B00V9JP8EE,False,False,4.5,117730
15,"VIVITEST Ceramic Diffuse,Stone Essential Oil Diffuser, Ultrasonic Aromatherapy Diffusers for Home",B08TR1H7LG,False,False,4.0,4588
16,"EQUSUPRO Essential Oil Diffuser 150ml Metal Aromatherapy Oil Diffuser Ultrasonic Cool Mist Diffuser with Waterless Auto Shut-Off Protection,7 Colors Changed LED for Home Office SPA Yoga (Tree)",B07JNMQBV4,False,False,4.4,21246
17,"Oil Diffuser Humidifier 300ML,Electric Ultrasonic Air Aroma Diffusers Vaporizer,Scent Mist Defuser with Remote,Auto-Off,7led Color Changing Light for Large Bed Room,Home,Office",B09TSZDGKN,False,False,4.5,550
18,"Essential Oil Diffusers 550ml ,10 Essential Oils Diffuser Gift Set,Advanced Ceramic Ultrasonic Technology Aromatherapy Diffusers Auto Shut-Off for 15 Ambient Light Settings（Black）",B09SYTWJNG,False,True,4.4,2459
19,"InnoGear Handcrafted Aromatherapy Diffuser for Essential Oils Ultrasonic Cool Mist Humidifier with 2 Mist Modes Waterless Auto Off for Room Office, Ceramic White, 150ML",B0B5ZK27K5,False,True,4.5,288
20,"Aroma Diffuser for Essential Oil Large Room Diffusers Set with 10 Essential Oils,Ultrasonic 550ml Aromatherapy Diffuser with Essential Oil, Bedroom Vaporizer Cool Mist Humidifier for Home Office",B08HRV1P33,False,True,4.4,13766
21,"NEWYID Essential Oil Diffusers, 240ml Ultrasonic Flame Oil Diffuser, 3 Mist Mode 4 Timer Up to 12H of Continuous Aroma Waterless Auto-Off Diffusers for Essential Oil Large Room",B09XK4YPPL,False,True,4.4,1692
22,"Diffusers for Essential Oils Large Room, 500ml Aromatherapy Diffuser，7 Colors Changed",B08JQ6FS8G,False,False,4.3,11897
23,"Essential Oil Diffusers for Home, 150ml Aroma Humidifier for Office, Water Shortage Protection, 7 Color LED Lights White Scent Mist 5V USB Dorm Room Essentials Aromatherapy Ultrasonic Diffusers",B09T6NSFQX,False,False,4.3,724
24,Diffuserlove Flame Diffuser Humidifier Essential Oil Diffusers 200ml Desk Aroma Diffusers for Home Office Cool Fire Air Diffuser…,B0C9HB3467,False,False,4.7,84
25,"Essential Oil Diffusers with Top 10 Oils Gift Set, 550ml Aroma Diffuser, Ultrasonic Cool Mist Aromatherapy Diffuser Waterless Auto Shut-Off for Home Office 4 Timers 15 Colors (Yellow)",B0BYYNMH1Z,False,False,4.5,412
26,"COCORRÍNA Reed Diffuser Set, 6.7 oz Clean Linen Scented Diffuser with Sticks Home Fragrance Essential Oil Reed Diffuser for Bathroom Shelf Decor",B0B24QJ217,False,False,4.3,4403
27,Metal Essential Oils Diffuser 100ML Aromatherapy Diffuser Cool Mist Humidifier with 7 Colors Lights Waterless Auto Off Air Diffusers as Gifts for Moms Grandma Women Girls (Dragonfly),B09NLPW71Z,False,False,4.5,2597
28,"BZseed Aromatherapy Essential Oil Diffuser 550ml 12 Hours Wood Grain Aroma Diffuser with Timer Cool Mist Humidifier for Large Room, Home, Baby Bedroom, Waterless Auto Shut-off,7 Colors Lights Changing",B07CZDNPPY,False,False,4.4,18599
29,ENAROMA Essential Oil Diffuser 200ml Black Metal Tree Ultrasonic Aromatherapy Diffuser with Intermittent Setting LED Colorful Night Light Cool Mist Humidifier for Bedroom Office Home Décor,B0BJJHT11Q,False,False,4.5,199
30,"Oil Diffuser, 500ml Essential Oil Diffusers, Aromatherapy Diffuser with 2 Mist Mode 4 Timers＆7 Ambient Light Waterless Auto Off, Diffusers Large Room Home Office",B09YGWNBVC,False,False,4.3,454
31,"Essential Oil Diffuser 120ml Ultrasonic Aromatherapy Diffuser with Handmade Glass BPA Free Waterless Auto-Off, 4 Timer Setting 7 Colors Changed LED for Home Yoga Office",B087BSH579,False,False,4.5,8498
32,"SEEDSEEL 300ML Aroma Essential Oil Diffuser,8 Hours Wood Grain Cool Mist Aromatherapy Diffuser with Remote Control,USB-C Power Cable,Timer, 7 Color Light Changing Air Humidifier for Home,Bedroom",B09WMZR32G,False,False,4.1,2103
33,"SERENLUX Essential Oil Diffuser, Backflow Mist Like Cloud Fall Cloud Flow, 280ml Aromatherapy Humidifier with LED Lights, Waterless Auto Off, Air Aroma Scent for Home Office Large Room, White",B0B93WC2CY,False,False,4.5,141
34,URPOWER 1000ml Essential Oil Diffuser Remote Control 5 in 1 Ultrasonic Aromatherapy Oil Cool Mist Humidifier Running 20 Hours with Adjustable Mist Mode/4 Timer Settings for Large Room Study Yoga Spa,B0B2QXVXG7,False,False,4.6,26940
35,"ASAKUKI 700ml Premium Essential Oil Diffuser, 5 in 1 Ultrasonic Aromatherapy Fragrant Oil Vaporizer Humidifier, Timer and Auto-Off Safety Switch, 7 LED Light Colors",B072VRQMCF,False,False,4.5,14460
36,"BOXING Ceramic Diffuser,Stone Essential Oil Diffuser, Ultrasonic Aromatherapy Diffusers,Essential Oils for defusers for Home/Bedroom (100ML).",B0BG7V5Q1W,False,False,4.3,352
37,"Essential Oils for Diffusers for Home,Ceramic Diffuser for Essential Oils,Handmade Aroma Diffuser 100ML (Pottery Red)",B0BCX3YHH9,False,False,4.3,649
38,"COOSA Moon Essential Oil Diffuser, Glass Cool Mist Humidifier with 4 Timer,2 LED Colors and Waterless Auto Shut-Off Settings for Baby Home Office (250ml)",B083K59MY1,False,False,4.2,4251
39,"Homeweeks Diffusers, 100ml Colorful Essential Oil Diffuser with Adjustable Mist Mode,Auto Off Aroma Diffuser for Bedroom/Office/Trip (100 ML 1 Pack)",B01NBH66QV,False,False,4.3,20955
40,Miserwe 500ml Diffuser with Remote Control Waterless Automatic Shut Off Essential Oil Diffusers with Timing Mode Adjustable Oil Diffuser for Home,B087X83BV5,False,False,4.4,4447
41,"Aroma Diffusers 200ml Colorful Essential Oil Diffuser with Adjustable Mist Mode,Auto Off Aroma Diffuser for Bedroom/Office/Trip",B0C7TY64Z1,False,False,4.0,33
42,"SEEDSEEL Aromatherapy Essential Oil Diffuser, 300ML Remote Control Cool Mist Air Humidifier,Electric Aroma Diffuser with 4 Timers and 7 Color Changing LED Lights, for Large Room,Bedroom",B0B48VWCJ6,False,False,4.6,197
43,"Diffusers for Essential Oils Large Room, 500ml Aromatherapy Diffuser Cool Mist Humidifier with Remote Control,7 Colors Lights & 3 Mist Mode Waterless Auto Off for Women Office Home Black",B09TR6NDYD,False,False,4.2,1980
44,"MAXWINER Essential Oil Diffusers Ultrasonic 3D Glass Aromatherapy Diffuser, Auto Shut-Off, Timer Setting, 7 Colors LED Lights Changing for Home, Office, Spa 120ml",B08PYTG62X,False,False,4.6,3615
45,Earnest Living Essential Oil Diffuser White Ceramic Diffuser 100 ml Timers Night Lights and Auto Off Function Home Office Humidifier Aromatherapy Diffusers for Essential Oils,B07SN9F16V,False,False,4.5,6574
46,Diffuserlove 2 Pack 200ml Essential Oil Diffuser Ultrasonic Aromatherapy Diffuser Cool Mist Humidifiers with 7 Color LED Lights & Waterless Auto Shut-Off for Home Office Kitchen Bedroom,B07Q5Z44SJ,False,False,4.4,15267
47,"Glass Dome Essential Oil Diffuser with Glass Reservoir & Wood Base-Plastic Free, 200ml Ultrasonic Glass Diffuser for Aromatherapy with Timer 7 Color Light Auto-Off for Gift Home Office Yoga Pilates",B09SL1GW74,False,False,4.3,666
48,"NEWYID Essential Oil Diffusers, 240ml Ultrasonic Flame Oil Diffuser, 3 Mist Mode 4 Timer Up to 12H of Continuous Aroma Waterless Auto-Off Diffusers for Essential Oil Large Room",B09XK4YPPL,False,False,4.4,1692
49,"GuruNanda Honeycomb Diffuser (90 mL) - Covers up to 200 sq.ft, Auto Shut-Off & 7 LED Lights - Essential Oil Diffuser for Aromatherapy, Large Room, Office, Yoga - Promotes Healthy Sleep & Relaxation",B01MZ9G2DO,False,False,4.3,6084
50,"InnoGear Handcrafted Aromatherapy Diffuser for Essential Oils Ultrasonic Cool Mist Humidifier with 2 Mist Modes Waterless Auto Off for Room Office, Ceramic White, 150ML",B0B5ZK27K5,False,False,4.5,288
51,"InnoGear Essential Oil Diffuser with Oils, 100ml Aromatherapy Diffuser with 6 Essential Oils Set, Aroma Cool Mist Humidifier Gift Set, Dark Wood Grain",B07RXT1TB2,False,False,4.6,12126
52,"Essential Oil Diffuser, Lavender Plant Potted Aromatherapy Diffuser, 150ml Cold Mist humidifier, Super Quiet and Waterless auto Shut Off, ultrasonic Oil Diffuser for Home Office",B09GYBLY43,False,False,4.2,668
53,"NEWYID Essential Oil Diffusers, Upgraded Ultrasonic Cool Mist Aromatherapy Diffuser with 17 Ambient Lights& 4 Timer Touchscreen Button Flame Oil Diffusers Essential Oils for Large Room Home-White",B0C9BXRS5D,False,False,4.7,67
54,"Porseme 280ml Essential Oil Diffuser 3D Hand-Blown Glass Aroma Diffusor, Aromatherapy Unltrasonic Cool Mist deffuser, 7 Color Changing Humidifier, Waterless Shut-Off, Timer Function for Home Office",B07MN9XP95,False,False,4.6,2073
55,280ml Glass Essential Oil Diffuser Wood Grain Base Air Aroma Diffuser for Aromatherapy Cool Mist Humidifier with Safe Auto Shut-Off and 2 Mist Modes & 7 Color LED Night Lights for Home Office Room,B09877FDTX,False,False,3.9,1117
56,"Aromacare, Aromatherapy Aroma Diffuser for Essential Oils, Cool Mist Humidifier for Home Bedroom, One Fill for 10Hours with Night Light 2 Mist Mode Waterless Auto-Off",B091SC6YGD,False,False,4.3,3616
57,"Artificial Succulent Plants Potted Diffusers for Essential Oils with 7 Colors LED Light,Ceramic Cool Mist Super Quiet Aromatherapy Diffuser for Home Office Bedroom",B08JLTR844,False,False,4.2,3063
58,"Colorful Flame Fire Diffuser Humidifier, 7 Colors Changing Oil Diffuser, Ultra-Quiet Aroma Essential Oils Aromatherapy Diffusers for Large Room, Bedroom, Office(Timeable, Waterless Auto off-150ml)",B0C8D4NXWW,False,False,4.2,24
59,"Whole Foods Market, Ultrasonic Diffuser, Mini Bali",B07J1DG82N,True,False,4.1,154
