rank,title,id,marked_as_amazon,is_ad,rating,review_count
0,"Amazon Basics Plush Pet Bed and Dog Crate Pad, X-Large, 46 x 29 x 4 Inches, Gray",B07DZVTYQB,True,False,4.5,32131
1,"INVENHO Dog Beds for Large Dogs, Soft Plush Orthopedic Dog Bed, Waterproof Dog Crate Bed with Removable Cover and Nonskid Bottom, Egg Crate Foam Pet Bed Mat, Machine Washable (36""x27""x3"")",B0C5ZVKPDW,False,True,4.6,135
2,"Furhaven Orthopedic Dog Bed for Large/Medium Dogs w/ Removable Bolsters & Washable Cover, For Dogs Up to 55 lbs - Plush & Suede Sofa - Espresso, Large",B01JAY0PZ6,False,True,4.5,76195
3,"Utotol Dog Beds for Medium Dogs, Washable Medium Dog Bed Breathable Soft Pet Bed, Waterproof Non-Slip Bottom",B07RJWCQL3,False,True,3.9,10171
4,"Washable Dog Bed Deluxe Plush Dog Crate Beds Fulffy Comfy Kennel Pad Anti-Slip Pet Sleeping Mat for Large, Jumbo, Medium, Small Dogs Breeds, 35"" x 23"", Gray",B09D7DWTVB,False,False,4.6,10622
5,"BFPETHOME Dog Beds for Large Dogs, Orthopedic Dog Bed for Medium Large Dogs, Egg- Foam Dog Crate Bed (L(36 * 27 * 6.5) Inch, Grey)",B09N8W2SC4,False,False,4.6,2482
6,"SHU UFANRO Medium Dog Bed for Small Medium Dogs, Washable Rectangle Durable Puppy Bed, Orthopedic Dog Sofa Bed, Soft Breathable Sleeping Pet Cuddler Beds for Indoor with Anti-Slip Bottom, Grey",B0C3QJ9YN1,False,False,4.4,55
7,"Bedsure Orthopedic Dog Bed for Medium Dogs - Waterproof Dog Sofa Bed Medium, Supportive Foam Pet Couch Bed with Removable Washable Cover, Waterproof Lining and Nonskid Bottom, Grey",B089QXMQXK,False,False,4.6,30947
8,"Veehoo Calming Dog Bed & Cat Bed, Anti-Anxiety Small Dog Beds for Medium Dogs, Washable Donut Round Pet Bed with Fluffy Faux Fur for Puppy and Kitten, 23x23 inch, Brown",B0919W1ZBZ,False,False,4.3,140
9,"kimpets Dog Bed Calming Dog Beds for Small Medium Large Dogs - Round Donut Washable Dog Bed, Anti-Slip Faux Fur Fluffy Donut Cuddler Anxiety Cat Bed(20"")",B08SBKPDVM,False,False,4.3,1523
10,"Amazon Basics Cooling Elevated Dog Bed with Metal Frame, Large, 51 x 31 x 8 Inch, Grey",B076VXVB2L,True,False,4.5,67751
11,"Furhaven Orthopedic Dog Bed for Large Dogs w/ Removable Bolsters & Washable Cover, For Dogs Up to 95 lbs - Two-Tone Plush Faux Fur & Suede L Shaped Chaise - Espresso, Jumbo/XL",B0759BDY32,False,True,4.5,99099
12,"MIXJOY Dog Bed for Large Medium Small Dogs, Rectangle Washable Sleeping Orthopedic Pet Sofa Bed, Soft Calming Cat/Puppy Beds for Indoor Cats, Anti-Slip Bottom with Multiple Size (20'', Grey)",B094HXYVC2,False,True,4.5,3010
13,"Coohom Rectangle Washable Bed, Durable, Warming Comfortable Square Pet Crate Bed Simple Design Style, for Medium Large Dogs (25 INCH, Black)",B08DDD5FSY,False,True,4.5,2066
14,"Calming Dog & Cat Bed, Anti-Anxiety Donut Cuddler Warming Cozy Soft Round Bed, Fluffy Faux Fur Plush Cushion bed for Small Medium Dogs and Cats (20""/24""/27""/30"")",B08M5J8JMN,False,False,4.6,26427
15,"EHEYCIGA Washable Dog Beds for Large Dogs, Orthopedic Dog Bed for Crate with Removable Cover, Egg Crate Foam Pet Bed Mat for Medium Large Dogs Mattress Cushions, Fits Up to 60 Lbs Pets, Grey",B09D2V3X4B,False,False,4.4,2980
16,"BFPETHOME Orthopedic Dog Beds for Large Dogs-Waterproof Sofa Dog Bed with Removable Washable Cover, Large Dog Bed with Waterproof Lining and Nonskid Bottom,Pet Bed for Large Dogs.",B0BZNNN7H8,False,False,4.6,193
17,"Sunheir Orthopedic Dog Bed for Medium, Large and Extra Large Dogs, Large Dog Bed with Removable Waterproof Cover and Egg-Crate Foam, Pet Bed Machine Washable (36 x 27 x 3 inch, Grey)",B0BNT3SV9H,False,False,4.3,228
18,"Teodty Dog Beds for Large Dogs, Washable Pet Bed Mattress Comfortable, Warming Rectangle Bed for Medium and Large Dogs, Cat Pets",B0CGZSH6FH,False,True,3.8,243
19,"MIHIKK Orthopedic Dog Bed for Medium, Large Dogs, Egg-Crate Foam Dog Bed with Removable Cover, Pet Bed Machine Washable (35 x 22 x 3 inch, Dark Gray)",B093KV8T63,False,True,4.4,5313
20,MFOX Calming Dog Bed (L/XL/XXL/XXXL) for Medium and Large Dogs Comfortable Pet Bed Faux Fur Donut Cuddler Up to 25/35/55/100lbs,B08BNL7B6V,False,True,4.2,16313
21,"Coohom Deluxe Plush Bed Pet Cushion Crate Mat,Fulffy Comfy Kennel Anti-Slip Washable Pad for Medium Large X-Large Dogs(X-Large, Khaki)",B08RY3P84Z,False,True,4.4,4026
22,"MidWest Homes for Pets Bolster Dog Bed 18L-Inch Cinnamon Dog Bed or Cat Bed w/ Comfortable Bolster | Ideal for ""Toy"" Dog Breeds & Fits an 18-Inch Dog Crate | Easy Maintenance Machine Wash & Dry",B000TZ73EW,False,False,4.2,83696
23,"Asvin Small Dog Bed for Small Dogs, Cat Beds for Indoor Cats, Pet Bed for Puppy and Kitty, Extra Soft & Machine Washable with Anti-Slip & Water-Resistant Oxford Bottom, Grey, 20 inches",B08S3564FL,False,False,4.5,4854
24,"Washable Large Bed, Plush Soft Pet Carrier Pad,Anti-Slip Dog Bed Mat for Large Medium Small Dogs and Cats,Fluffy Comfy Dog Kennel Pad.",B0B6G83Q2Y,False,False,4.3,975
25,"Dog Crate Bed Washable Dog Beds for Large Dogs Deluxe Thick Flannel Fluffy Comfy Kennel Pad Anti-Slip & Anti-Scratch Pet Sleeping Mat, 35 x 23 Inch, Gray",B09MK8MFR5,False,False,4.4,4253
26,"PUPPBUDD Dog Beds for Medium Dogs, Rectangle, Washable, Comfortable and Breathable Pet Sofa Warming Orthopedic For Dog",B085RZHH8H,False,False,3.9,20796
27,"KISYYO Dog Beds for Large Dogs Fixable Deluxe Cozy Dog Kennel Beds for Crates Washable Dog Bed, 36 x 23 x 3.8 Inches, Grey",B0BPNZLQ5V,False,False,4.2,1681
28,"WNPETHOME Orthopedic Dog Beds for Large Dogs, Extra Large Waterproof Dog Bed with Removable Washable Cover & Anti-Slip Bottom, Egg Crate Foam Pet Bed Mat, Multi-Needle Quilting XL Dog Crate Bed",B0BRZW6LFZ,False,False,4.4,427
29,"Washable Dog Bed Dog beds for Large Dogs, Anti-Slip Dog Crate Bed for Large Medium Small Dogs, Dog beds & Furniture",B09V12JF1N,False,False,4.4,4089
30,"MIXJOY Dog Beds for Small Medium Large Dogs, Pet Bed Calming Cat & Puppy Bed, Washable Rectangle Orthopedic Dog Sofa Bed, Soft Sleeping Warming Kitten Bed with Anti-Slip Bottom-20''x19''x6''",B0C44WPWRF,False,False,4.5,3010
31,"BFPETHOME Sofa Dog Beds for Large Dogs, Washable Large Dog Bed with Bolster, Orthopedic Large Dog Beds with Removable Covers & Waterproof Dog Bed for Pet",B0BC1GQXNY,False,False,4.6,426
32,"Amazon Basics Plush Pet Bed and Dog Crate Pad, X-Small, 23 x 18 x 2.5 Inches",B07DZJR1P7,True,False,4.5,32131
33,"WNPETHOME Orthopedic Large Dog Bed, Dog Bed for Large Dogs with Egg Foam Crate Pet Bed with Soft Rose Plush Waterproof Dog Bed Cover Washable Removable (M（36 * 27 * 3in）, Grey)",B0946XHLKK,False,False,4.4,3629
34,"DogBaby Dog Beds for Large Medium Dogs, Washable Medium Dog Bed, Dog Couch Bed for Comfortable Sleep, Orthopedic Egg Foam Bolster Dog Bed with Removable Washable Cover and Nonskid Bottom, Pet Bed",B0C2GZMJPW,False,False,4.7,287
35,"Dog Crate Bed Waterproof Deluxe Plush Dog Beds with Removable Washable Cover Anti-Slip Bottom Pet Sleeping Mattress for Large, Medium, Jumbo, Small Dogs, 35 x 22 inch, Gray",B0BQQJKGNG,False,False,4.5,882
36,"Bedsure Calming Dog Bed for Small Dogs - Donut Washable Small Pet Bed, 23 inches Anti-Slip Round Fluffy Plush Faux Fur Large Cat Bed, Fits up to 25 lbs Pets, Camel",B08CXQY47M,False,False,4.7,15014
37,"INVENHO Small Dog Bed for Small Medium Large Dogs, Rectangle Washable Dog Bed, Orthopedic Dog Sofa Bed, Durable Plush Pet Bed, Soft Calming Sleeping Puppy Bed with Anti-Slip Bottom S(20""x19""x6"")",B0B9QY2QN5,False,False,4.5,284
38,"Bedsure Dog Bed for Large Dogs - Big Orthopedic Dog Bed with Removable Washable Cover, Egg Crate Foam Pet Bed Mat, Suitable for Dogs Up to 65 lbs",B07ZGMGTCJ,False,False,4.5,43471
39,"DOGKE Large Washable Dog Bed Deluxe Fluffy Plush Dog Crate Pad，Dog Beds Made for Large, Medium, Small Dogs and Cats, Anti-Slip Dog Crate Bed for Sleeping and Anti Anxiety, 32""x22"", Gray",B0BHZR9HZ1,False,False,4.2,1267
40,"Bedsure Dog Beds for Small Dogs - Round Cat Beds for Indoor Cats, Washable Pet Bed for Puppy and Kitten with Slip-Resistant Bottom, 20 Inches, Taupe",B08CZ8TB83,False,False,4.6,9228
41,Orthopedic Sofa Dog Bed - Ultra Comfortable Dog Beds for Medium Dogs - Breathable & Waterproof Pet Bed- Egg Foam Sofa Bed with Extra Head and Neck Support - Removable Washable Cover & Nonslip Bottom,B0BFZRMD36,False,False,4.6,1590
42,"JOEJOY Rectangle Dog Bed for Large Medium Small Dogs Machine Washable Sleeping Sofa Non-Slip Bottom Breathable Soft Puppy Bed Durable Orthopedic Calming Pet Cuddler, Multiple Size, Beige",B0967W65J3,False,False,4.4,3941
43,"Orthopedic Dog Bed, Bolster Couch Bed for Large Dogs, Removable Washable Cover Pet Foam Nonskid Mat (Large(36''*26''), Grey)",B093STHQ76,False,False,4.3,2389
44,"EHEYCIGA Shredded Memory Foam Dog Beds for Large Dogs, Waterproof Orthopedic Large Dog Bed for Crate with Washable Removable Cover, Pet Bed Dog Mattress Dog Pillow with Non-Slipped Bottom, Grey",B0C69PY19Q,False,False,3.8,60
45,"Furhaven Orthopedic Dog Bed for Large/Medium Dogs w/ Removable Bolsters & Washable Cover, For Dogs Up to 55 lbs - Quilted Sofa - Toasted Brown, Large",B01L7ZV8XE,False,False,4.5,76195
46,"Furhaven Orthopedic Dog Bed for Large Dogs w/ Removable Bolsters & Washable Cover, For Dogs Up to 95 lbs - Plush & Velvet L Shaped Chaise - Sable Brown, Jumbo/XL",B0759KRD1V,False,False,4.5,99099
47,"Teodty Dog Beds for Large Dogs, Washable Pet Bed Mattress Comfortable, Warming Rectangle Bed for Medium and Large Dogs, Cat Pets",B0BS9JXLX5,False,False,3.8,2040
48,"WNPETHOME Dog Beds for Large Dogs, Orthopedic Sofa Dog Bed Mat Pillow with Removable Waterproof Cover, Egg-Foam Dog Crate Bed for Medium Large Dogs",B0BNDJ3CTS,False,False,4.5,362
49,Comfort Expression Waterproof Orthopedic Foam Dog Beds for Extra Large Dogs Durable Dog Sofa The Pet Bed Washable Removable Cover with Zipper and Bolster,B0B1ZYGR52,False,False,4.5,1447
50,"Yiruka XL Dog Bed, Orthopedic Washable Dog Bed with Removable Cover, Grey Waterproof Extra Large Dog Bed",B0B2HX528X,False,False,4.7,1887
51,"Laifug Orthopedic Memory Foam Extra Large Dog Bed Pillow(50""x36""x10"", Slate Grey) Durable Water Proof Liner & Removable Washable Cover & Smart Design",B0757MKHP1,False,False,4.6,8534
52,"Dog Bed, Plush Soft Pet Mat Pad & Furniture，Washable Anti-Slip Dog Crate Bed for Large Medium Small Dogs and Cats (36""x23.5"", Grey)",B0B3J4YJKZ,False,False,4.2,2027
53,"EHEYCIGA Orthopedic Dog Beds for Large Dogs, Waterproof Memory Foam Large Dog Bed with Sides, Non-Slip Bottom and Egg-Crate Foam Large Dog Couch Bed with Washable Removable Cover, Grey",B0BQ31QDJD,False,False,4.6,2206
54,"MINGT Dog Bed, Washable Dog Bed for Large Dogs Kennel pad, Anti-Slip Pet Sleeping for Medium Small Dogs Indoor & Outdoor Use (XL(43 x 29 in))",B0CBQH9ZXS,False,False,4.5,11
55,"EHEYCIGA Memory Foam Large Dog Bed for Large Dogs, Orthopedic Waterproof Dog Beds with Foam Sides, Non-Slip Bottom and Dog Couch with Washable Removable Corn Fleece Cover, Dark Grey",B0BTM8ZXKZ,False,False,4.5,258
56,"OhGeni Orthopedic Dog Beds for Large Dogs,Dog Bed with Plush Egg Foam Support and Non-Slip Bottom, Waterproof and Machine Washable Removable Pet Bed Cover",B0BMTRXLH2,False,False,4.4,943
57,"INVENHO Small Dog Bed for Large Medium Small Dogs, Rectangle Washable Dog Bed, Orthopedic Dog Bed, Soft Calming Sleeping Puppy Bed Durable Pet Cuddler with Anti-Slip Bottom S(20""x19""x6"")",B0B2NQV8QV,False,False,4.4,1472
58,"WESTERN HOME Orthopedic Dog Beds for Large Dogs, Foam Pet Sofa with Waterproof Lining, Removable Washable Cover and Nonskid Bottom, Dog Couch Bed for Comfortable Sleep",B094TTB3FV,False,False,4.6,2167
59,"Dog Crate Bed Waterproof Dog Beds for Medium Dogs Rose Velvet Soft Fluffy Washable Dog Bed with Removable Cover & Anti-Slip Bottom, 35 x 22 Inch, Gray",B0BBLK5X34,False,False,4.4,2021
