rank,title,id,marked_as_amazon,is_ad,rating,review_count
0,"365 by Whole Foods Market, Outstanding Orange Kids Foaming Hand Soap, 12 Fl Oz",B08GGR5HLS,True,False,4.5,119
1,"Mosaic Liquid Hand Soap / Hand Wash Gift Set, Ideal Bathroom Hand Soap and Kitchen Hand Soap Set , Olive Oil + Coconut & Hibiscus + Gardenia + Orange Blossom, 4 x 24.6 fl oz Each Liquid Soap Bottle",B099NYSG6G,False,True,4.5,956
2,A LA MAISON de Provence Liquid Hand Soap | Rosemary Mint Scent | French Milled Moisturizing Natural Hand Soap | in 16.9 oz. Pump Bottles | (3 Pack),B004ABTGS2,False,True,4.6,6950
3,"BARR-CO. Fir & Grapefruit Hand Soap, Bright Grapefruit and Cooling Balsam, Natural Liquid Soap for Bathroom & Kitchen, Vegan Formula, 16 fl oz",B0CD14KSS5,False,True,4.5,229
4,"Mrs. Meyer's Hand Soap, Made with Essential Oils, Biodegradable Formula, Rain Water, 12.5 fl. oz - Pack of 3",B07TJG79HP,False,False,4.7,119734
5,"Softsoap Moisturizing Liquid Hand Soap, Soothing Clean Aloe Vera - 7.5 Fl Oz (Pack of 6)",B079FV8QB9,False,False,4.8,25241
6,"Softsoap Liquid Hand Soap, Fresh Breeze - 7.5 Fl Oz (Pack of 6)",B079FV6PRH,False,False,4.8,43000
7,"Softsoap Moisturizing Liquid Hand Soap, Milk and Honey, 7.5 Fluid Ounce, Pack of 6 (Package may vary)",B079FYJC97,False,False,4.8,30473
8,"Mrs. Meyer's Hand Soap Refill, Made with Essential Oils, Biodegradable Formula, Lavender, 33 fl. oz",B00262227E,False,False,4.7,4718
9,"MRS. MEYER’S CLEANDAY Hand Soap, Made with Essential Oils, Biodegradable Formula, Lavender, 12.5 fl. oz - Pack of 3",B01N1N6FMZ,False,False,4.8,27220
10,"Amazon Basics Liquid Hand Soap Refill, Milk and Honey Scent, Triclosan-free, 50 Fluid Ounces, Pack of 1",B09HHBV8CB,True,False,4.7,6639
11,"Muse Bath Apothecary Hand Ritual - Aromatic and Nourishing Hand Soap, Infused with Natural Aromatherapy Essential Oils - 16 oz, Fleur du Lavender, 2 Pack",B07QQ3FQ3M,False,True,4.3,4005
12,"Eucalyptus Hand + Body Wash — cleansing, purifying, hydrating for women and men. for all skin types, even sensitive. no stripping or irritation. Cruelty-free + vegan",B07XSMWKVY,False,True,4.6,331
13,"Hand in Hand Nourishing Liquid Hand Soap, 10 Fl Oz, Multi-Scented, Citrus Grove, Cactus Blossom, Sea Salt & Sweetgrass Scent, 4 Pack",B09Q6HWJZ7,False,True,4.1,1169
14,"MRS. MEYER'S CLEAN DAY Hand Soap Refill, Made with Essential Oils, Biodegradable Formula, Rain Water, 33 fl. oz",B07MFMWFYL,False,False,4.8,1585
15,"Method Foaming Hand Soap, Waterfall, Biodegradable Formula, 10 Fl Oz (Pack of 1)",B004SNAGRC,False,False,4.7,1130
16,"MRS. MEYER'S CLEAN DAY Hand Soap, Made with Essential Oils, Biodegradable Formula, Clementine, 12.5 Fl. Oz - Pack Of 3",B0BC2D3MS5,False,False,4.8,726
17,"Softsoap Deeply Moisturizing Liquid Hand Soap, Shea Butter, Lavender, 11.25 Fl Oz",B08P3FC912,False,False,4.7,533
18,"MyKirei by KAO Foaming Hand Soap with Japanese Yuzu Flower, Nourishing Hand Wash, Paraben/Cruelty Free and Vegan Friendly, Sustainable Bottle, Pump 8.5 Ounce Citrus",B08BBHNM1L,False,True,4.6,3086
19,"A LA MAISON Liquid Hand Soap Variety Pack - Yuzu Lime, Provence Lemon, and Heirloom Peach Triple French Milled Natural Moisturizing Soap (3 Pack, 16.9 oz Bottle)",B08GD1C269,False,True,4.3,73
20,"Brittanie's Thyme Basics Natural Olive Oil Hand Soap, Lemongrass Tea Tree - 12 fl oz, Pack of 3 - Cruelty Free, Vegan, No Synthetic Additives, No Sulfates, Paraben Free, Phthalate Free",B0955FYWF9,False,True,4.5,145
21,Panier des Sens - Marseille Liquid Hand Soap - Provence Hand Wash - Moisturizing Soap with Coconut Oil - Bathroom & Kitchen Refillable Soap - 97% Natural Ingredients Made in France - 16.9 Fl.oz,B004FNM164,False,True,4.4,2285
22,"Method Foaming Hand Soap, Sea Minerals, Biodegradable Formula, 10 fl oz (Pack of 3)",B08KKVY2QQ,False,False,4.7,1238
23,"Amazon Basics Original Fresh Liquid Hand Soap, 32 Fluid Ounce, Pack of 2 (Previously Solimo)",B089WRB791,True,False,4.5,14982
24,"Amazon Basics Antibacterial Liquid Hand Soap Refill, Light Moisturizing, Triclosan-Free, Citrus, 50 Fl Oz, 2-Pack (Previously Solimo)",B09HHBZXB7,True,False,4.4,19110
25,"Softsoap Antibacterial Liquid Hand Soap, Crisp Clean Scent Hand Soap, 11.25 Ounce, 6 Pack",B01LTI987M,False,False,4.8,14738
26,"Amazon Basics Liquid Hand Soap Refill, Mango & Coconut Water Scent, Triclosan-Free, 50 Fl Oz (Pack of 2)",B09HHBZX91,True,False,4.6,14912
27,"MRS. MEYER'S CLEAN DAY Hand Soap, Made with Essential Oils, Biodegradable Formula, Limited Edition Acorn Spice, 12.5 fl. oz - Pack of 3",B0B64GDDT4,False,False,4.8,6902
28,"Softsoap Antibacterial Liquid Hand Soap Refill, White Tea & Berry Scented Hand Soap, 50 Ounce",B081FFRGZB,False,False,4.4,1803
29,"Softsoap Antibacterial Liquid, Fresh Citrus Scent Hand Soap, 11.25 Ounce, 6 Pack",B0716CKB4Y,False,False,4.8,9524
30,"Amazon Basics Gentle & Mild Clear Liquid Hand Soap Refill, Triclosan-free, 50 Fluid Ounces, 1-Pack (Previously Solimo)",B09HHDHXWX,True,False,4.6,24599
31,"Amazon Basics Liquid Hand Soap Refill, Milk and Honey Scent, Triclosan-free, 50 Fluid Ounces, Pack of 1",B09HHBV8CB,True,False,4.7,6639
32,"Everyone Liquid Hand Soap, 12.75 Ounce (Pack of 3), Pacific Eucalyptus, Plant-Based Cleanser with Pure Essential Oils",B0B6YG64BC,False,False,4.7,29982
33,"Dove Foaming Hand Wash Aloe & Eucalyptus Pack of 4 Protects Skin from Dryness, More Moisturizers than the Leading Ordinary Hand Soap, 10.1 oz",B08XYBMPXH,False,False,4.6,5461
34,"Jergens Extra Moisturizing Hand Soap, Liquid Hand Soap Dispenser with Jergens Cherry Almond Scent, Hand Wash For Dry Hands, 8.3 Ounces (Pack of 3)",B099NZPC9H,False,False,4.7,1327
35,"J.R. Watkins Foaming Hand Soap with Pump Dispenser, Moisturizing Foam Hand Wash, All Natural, Alcohol-Free, Cruelty-Free, USA Made, Lemon, 9 fl oz, 3 Pack",B0B3S3NGXB,False,False,4.7,23127
36,"Muse Bath Apothecary Hand Ritual - Aromatic and Nourishing Hand Soap, Infused with Natural Aromatherapy Essential Oils - 16 oz, Aloe + Eucalyptus + Lavender, 2 Pack",B07QSCRBH6,False,False,4.3,4005
37,"Method Foaming Hand Soap, Waterfall, Biodegradable Formula, 10 fl oz (Pack of 6)",B011OJQ1CQ,False,False,4.7,1765
38,"MRS. MEYER’S CLEANDAY Hand Soap, Made with Essential Oils, Biodegradable Formula, Rain Water, 12.5 fl. oz",B07MG5YJLT,False,False,4.8,5414
39,"Mrs. Meyer's Hand Soap, Made with Essential Oils, Biodegradable Formula, Honeysuckle, 12.5 fl. oz - Pack of 3",B01N004WAJ,False,False,4.8,18119
40,"Method Gel Hand Wash, French Lavender, Biodegradable Formula, 12 fl oz (Pack of 3)",B08KKCT29M,False,False,4.6,529
41,"Method Foaming Hand Soap, Sweet Water, Biodegradable Formula, 10 fl oz (Pack of 3)",B08KKK8D8J,False,False,4.7,1971
42,"J.R. Watkins Liquid Hand Soap With Dispenser, Moisturizing Hand Soap, Alcohol-Free Hand Wash, Cruelty-Free, USA Made Liquid Soap For Bathroom or Kitchen, Lemon, 11 Fl Oz, 3 Pack",B0C34DXX98,False,False,4.1,117
43,Bath & Body Works Assorted 5 Pack Gentle Foaming Hand Soap,B084H1V96M,False,False,4.6,15382
44,"Method Gel Hand Soap, Vetiver + Amber, Reusable Black Aluminum Bottle, Biodegradable Formula, 12 oz (Pack of 3)",B09QXM15F6,False,False,4.5,415
45,"365 by Whole Foods Market, Hand Soap Foaming Mint Garden, 12 Fl Oz",B085D536Z3,False,False,4.6,900
46,"Dial Complete Antibacterial Foaming Hand Wash, Fresh Pear, 7.5 fl Oz (Pack of 8)",B0015IW3PG,False,False,4.7,47422
47,"RAW SUGAR Hand Wash Variety Bundle - Lemon Sugar, Watermelon + Fresh Mint, Pineapple + Maqui Berry + Coconut & Raw Coconut + Mango, Formulated without Sulfates & Parabens (16.9 fl. oz, Pack of 4)",B0B6GNQBQ7,False,False,4.6,607
48,"Method Foaming Hand Soap, Pink Grapefruit, 10 fl oz, Biodegradable Formula, (Pack of 3)",B08KKQCNVR,False,False,4.7,8398
49,"Mrs. Meyer's Hand Soap, Made with Essential Oils, Biodegradable Formula, Limited Edition Iowa Pine, 12.5 fl. oz - Pack of 3",B09CLLQCZK,False,False,4.8,2592
50,"MRS. MEYER'S CLEAN DAY Hand Soap Refill, Made with Essential Oils, Biodegradable Formula, Honeysuckle, 33 oz",B0789HTHJW,False,False,4.7,1426
51,"Everyone Liquid Hand Soap Refill, 1 Gallon, Meyer Lemon and Mandarin, Plant-Based Cleanser with Pure Essential Oils",B094F6L3GR,False,False,4.8,913
52,"NEST Fragrances Moroccan Amber Liquid Hand Soap, 10 Fl Oz",B099LPWWCV,False,False,4.5,1511
53,"Dove Advanced Care Hand Wash Shea Butter & Warm Vanilla 4 Count for Soft, Smooth Skin, More Moisturizers than the Leading Ordinary Hand Soap, 12 oz",B0BV12Q2PZ,False,False,4.7,239
54,"Dial Complete Antibacterial Liquid Hand Soap Refill, Gold, 52 fl Oz (Pack of 3)",B076MW7XDZ,False,False,4.7,4693
55,"EO Liquid Hand Soap, 12 Ounce (Pack of 3), French Lavender, Organic Plant-Based Gentle Cleanser with Pure Essential Oils",B08167KP49,False,False,4.6,1376
56,"Clorox Antibacterial Liquid Hand Soap Pump - 16 oz Citrus Burst Antibacterial Hand Soap - Liquid Hand Soap Eliminates Germs and Bacteria, Soft on Hands Tough on Dirt",B08T1WCHJS,False,False,4.5,1221
57,"Method Gel Hand Soap, Sweet Water, Biodegradable Formula, 12 fl oz (Pack of 3)",B08KKK8D8K,False,False,4.7,668
58,"Softsoap Milk & Honey Scented, Liquid Hand Soap Refill, 50 Ounce",B07L98GZH9,False,False,4.7,3187
59,"Dove Purify and Care Limited Edition Hand Wash, 18.59 Ounce (Pack of 2)",B09DFNXFV6,False,False,4.8,434
