rank,title,id,marked_as_amazon,is_ad,rating,review_count
0,"Amazon Basics 100% Cotton, Soft & Absorbent, Popcorn Texture Terry Kitchen Dish Towels, 28""L x 16""W, Beige Stripe, Pack of 8",B08KDXHVL1,True,False,4.7,3276
1,"8Pack Kitchen Dish Towels ,100% Cotton Dish Cloths, Super Soft,Super Absorbent and Quick Drying Anti Odor,Very Suitable for Kitchen Cooking and Cleaning Kitchenware Washing,Drying Dishes (Gray)",B0B84TPG1D,False,True,4.4,1311
2,"Bounty Quick-Size Paper Towels, White, 16 Family Rolls = 40 Regular Rolls",B079VP6DH5,False,True,4.8,113269
3,"Premium Kitchen Dish Hand Towels (20”x 28”, 6 Pack) | Large,Cotton Flat & Terry Highly Absorbent Tea Towels Set with Hanging Loop | Navy Blue",B08DVBMXXW,False,True,4.7,8922
4,"Homaxy 100% Cotton Waffle Weave Kitchen Dish Cloths, Ultra Soft Absorbent Quick Drying Dish Towels, 12x12 Inches, 6-Pack, Dark Grey",B07WMQP4SF,False,False,4.5,21598
5,"LANE LINEN Kitchen Towels Set - Pack of 6 Cotton Dish Towels for Drying Dishes, 18”x 28”, Kitchen Hand Towels, Tea Towels, Premium Dish Towels for Kitchen, Quick Drying Kitchen Towel Set - Beige",B09SKJ9FPQ,False,False,4.6,1655
6,"Homaxy 100% Cotton Terry Kitchen Towels(Black, 13 x 28 inches), Checkered Designed, Soft and Super Absorbent Dish Towels, 4 Pack",B08R6VYDSP,False,False,4.5,3799
7,"Premium Kitchen Dish Hand Towels (20”x 28”, 6 Pack) | Large,Cotton Flat & Terry Highly Absorbent Tea Towels Set with Hanging Loop | Navy Blue",B08DVBMXXW,False,False,4.7,8922
8,"LANE LINEN Kitchen Towels Set - 100% Pure Cotton Dish Towels for Kitchen, Super Absorbent Kitchen Hand Towel, Blue Tea Towels, Soft & Durable Dish Cloths, Pack of 12 – 15”x25”, Blue Stripe",B09SKY1YWR,False,False,4.4,931
9,"Microfiber Dish Towels, Stripe Designed, Super Soft and Absorbent Dishcloth, Pack of 8, 12 x 12 Inch, Gray and White",B08KXPSTFG,False,False,4.6,1858
10,"Amazon Basics 100% Cotton Terry Reversible Flour Sack Kitchen Towels, 12 Pack, White, 28""L x 27""W",B08KDXML96,True,False,4.7,436
11,"Premium Kitchen Towels (16”x 28”, 6 Pack), 3 pc Yarn Dyed + 3 Solid – Multiple Kitchen Towel Set Design - 380 GSM Highly Absorbent Tea Towels Set with Hanging Loop (Tan, Kitchen Towels Diamond Design)",B08TWJXHLG,False,True,4.7,564
12,"100% Cotton Kitchen Towels Set,Waffle Weave Kitchen Dish Cloth,Super Absorbent Kitchen Dish Towels for Drying Dishes 13x13 Inches Dish Rags for Washing Dishes 6 Pack Mixed Color,Hand Towels",B098QGY4KH,False,True,4.1,425
13,"Urban Villa Kitchen Towels, Premium Quality, Cotton Dish Towels,Mitered Corners,Ultra Soft (Size: 20X30 in),Multi Color Waffle Stripes, Highly Absorbent Bar Towels & Tea Towels - (Set of 8)",B07YMZJYKT,False,True,4.6,3211
14,"KitchenAid Albany Kitchen Towel 4-Pack Set, Cotton, Milkshake Tan/White, 16""x26""",B08J8CM68R,False,False,4.7,4779
15,COTTON CRAFT Oversized Kitchen Towels - 4 Pack 100% Cotton Basketweave Tea Dish Towels - Absorbent Reusable Low Lint Quick Dry - Cooking Drying Restaurant Bar Cleaning Cloth Napkin -20x30 Coral Stripe,B0083VS24O,False,False,4.6,2668
16,"Microfiber Dish Towels - Soft, Super Absorbent and Lint Free Kitchen Towels - 8 Pack (Lattice Designed Gray Colors) - 26 x 18 Inch",B084YY3H1Q,False,False,4.6,9816
17,"Homaxy 100% Cotton Waffle Weave Check Plaid Kitchen Towels, 13 x 28 Inches, Super Soft and Absorbent Dish Towels for Drying Dishes, 4-Pack, White & Black",B08T93YXWP,False,False,4.6,2336
18,Urban Villa Kitchen Towels Cuisine Stripes Premium Quality 100% Cotton Dish Towels Mitered Corners Ultra Soft (Size: 20X30 Inch) Red Multi Highly Absorbent Bar Towels & Tea Towels - (Set of 6),B07S6BT43B,False,True,4.6,5130
19,"ARKENY Fall Kitchen Towels Set of 2,Orange Pumpkin Grey Buffalo Check Autumn Dish Towels 18x26 Inch Drying Dishcloth,Farmhouse Home Decoration AD118",B0CD1LSKMY,False,True,3.8,7
20,"Sratte 6 Pcs Christmas Kitchen Towels Buffalo Check Plaid Dish Towels Winter Truck Hand Towels Farmhouse Tea Towels Housewarming Gifts Christmas Decoration for Kitchen Holiday Xmas, 23.62 x 15.75 Inch",B0C6XSWH26,False,True,3.6,21
21,"Homaxy 100% Cotton Terry Kitchen Towels(Black, 13 x 28 inches), Checkered Designed, Soft and Super Absorbent Dish Towels, 4 Pack",B08R6VYDSP,False,True,4.5,3799
22,"6 Pack Kitchen Towels and Dishcloths Sets,100% Cotton Soft Absorbent Quick Drying Dish Towels for Kitchen,Washing Dishes,12x12 Inches, Multi Color",B09TP8MDMS,False,False,4.5,1452
23,"Ritz Premium Kitchen Towel and Dish Cloth Value Set (6-Pack), Highly Absorbent, Super Soft, Long-Lasting, 100% Cotton Checked and Solid Hand Towels, Tea Towels, Bar Towels, Paprika Red",B09C9DX1KP,False,False,4.3,126
24,Set of 6 Mandala Kitchen Towels Absorbent Dish Towels Mandala Towels 24 x 16 Inches Kitchen Gifts Kitchen Hand Towels Mandala Lover Gifts for Farmhouse Kitchen Bathroom Decorations,B0BWRRNJ8L,False,False,4.1,101
25,"AIDEA Dish Towels-8Pack, 18”x26”, Super Soft and Absorbent, Multi-Purpose Microfiber Kitchen Towels for Home, Kitchen-Grey/White",B08G1B83F6,False,False,4.5,2437
26,"[12 Pack] Cotton Kitchen Towels - Waffle Weave for Embroidery Absorbent Terry Cloth Dish Towels for Washing Hand and Drying Dishes Rags 15x26 Inches, Aqua",B0BPDYB2CN,False,False,4.7,2579
27,"Infinitee Xclusives Premium Kitchen Towels – Pack of 6, 100% Cotton 15x25 Inches Absorbent Dish Towels - Tea Towels- Terry Kitchen Dishcloth Towels- Grey Dish Cloth for Household Cleaning",B0982ZVLJF,False,False,4.7,4837
28,"Utopia Towels Dish Towels, 15 x 25 Inches, 100% Ring Spun Cotton Super Absorbent Linen Kitchen Towels, Soft Reusable Cleaning Bar and Tea Towels Set (12 Pack, Blue)",B00JCG1V42,False,False,4.5,18553
29,"Dish Towels Set, 100% Cotton Waffle Weave Kitchen Towels 4 Pieces, Super Absorbent Kitchen Hand Dish Cloths for Drying and Cleaning (17 x 25 Inches, Set of 4)",B086QPCLPM,False,False,4.4,2722
30,"Zeppoli Classic Dish Towels - 15 Pack - 14"" by 25"" - 100% Cotton Kitchen Towels - Reusable Bulk Cleaning Cloths - Blue Hand Towels - Super Absorbent - Machine Washable",B01IG8X9E6,False,False,4.5,36406
31,"Cotton Waffle Weave Kitchen Towels | Soft & Absorbent Dish Towels Tea Towel | Quick Drying Hand Towels for Kitchen | 13"" x 28"" 3 Pack (Brown Set)",B0CBKDMDF3,False,False,4.5,180
32,"100% Cotton Waffle Weave Kitchen Towels, 13 x 28 Inches, Super Soft and Absorbent Buffalo Check Dish Towels for Drying Dishes, 4-Pack, Black & White",B094QJW13K,False,False,4.6,3245
33,"Cotton Kitchen Towels Set of 4 - Absorbent Dish Towels Set | Tea Towels | Bar Towels | Lemon Yellow Printed Kitchen Dish Towels - Multi Purpose Kitchen Linen, Drying Dish Hand Towels 20x28",B08M6FH97C,False,False,4.5,492
34,"Cotton Kitchen Towels Absorbent Dish Towels Set, Waffle Weave Hand Towels, Ultra Soft Dish Drying Towels, Quick Drying Dish Towel - 17 x 25 Inches, 6 Pack",B0B2P6L9ZX,False,False,4.4,672
35,"Kitinjoy 100% Cotton Kitchen Dish Cloths, 6 Pack Waffle Weave Ultra Soft Absorbent Dish Towels for Drying Dishes Quick Drying Kitchen Towels Dish Rags, 12 X 12 Inches, Dark Grey",B0837B5Z6R,False,False,4.5,3076
36,"Flour Sack Dish Towels - Natural Cotton for Embroidery and Drying Glass, Hand, Dinnerware - Plain, Thick, Zero-Lint, Highly Absorbent - Set of 12, 27 x 27 Inch, Tuxedo Black",B09WG9CYT9,False,False,4.7,4256
37,"Utopia Towels Kitchen 12 Pack, 15 x 25 Inches, 100% Ring Spun Cotton Super Soft and Absorbent Linen Dish Towels, Tea Bar Set (Grey)",B07NBHQ1YC,False,False,4.6,53824
38,"Salsa Stripe Kitchen Dish Towels, 100% Cotton, Highly Absorbent, Multi Purpose Waffle Tea Towels for Cooking,Drying&Cleaning (16x28 Inches) - Pack of 12 for Christmas and Thanks Giving",B07HH3CKC8,False,False,4.6,5395
39,"DII Assorted Woven Kitchen Set, Dishtowel, 18x28, Dishcloth, 13x13, Spice, 5 Piece",B00J2RX6NA,False,False,4.5,1076
40,"T-fal Premium Kitchen Towel (4-Pack), 12""x13"" Highly Absorbent, Super Soft Long Lasting 100% Cotton Flat Waffle Dish Towel for Washing Dishes, Gray",B01M3SP2T1,False,False,4.5,2475
41,"Now Designs Kitchen Dishcloths Ripple, Set of 4, Lemon Yellow, 4 Count",B002H9XBCQ,False,False,4.5,2402
42,"Kitchen Towels and Dishcloths Set, 16 x 25 12 12, Set of Bulk Cotton Dish for Washing Dishes Rags Everyday Cooking Baking",B091HZRV5B,False,False,4.6,4315
43,"Simpli-Magic 79165 Kitchen Towels, Pack of 15, Towels, 15"" x 26"", Herringbone Multi-Color",B07RGXR3C5,False,False,4.4,8309
44,"10 Pack Kitchen Cloth, Microfiber Dish Towels Washcloths, Super Absorbent Coral Velvet Dishtowels, Premium Cleaning Cloths,Non-Stick Oil Quick Dry Dish Towels, Soft Tea Towels, Table Cleaning Cloths.",B092Z1NHRN,False,False,4.3,5939
45,"Kitchen Dish Towels Heavy Duty Absorbent Dish Cloths with Hanging Loop 100% Cotton Tea Bar Towels (16x26, Set of 3) (Green)",B09ZV4TB7N,False,False,4.5,4752
46,"Waffle Weave Kitchen Towels, 100% Cotton, Set of 4 Cloths for Washing Dishes, Kitchen Dish Towels 12x12 Inches, Cream White and Blue",B0BW2533ZJ,False,False,5.0,2
47,"Kitchen Towels 16""x 28"" | Dish Towels | Kitchen Hand Towels | Large Dishcloths Set | Highly Absorbent Tea Towel, Soft with Hanging Loop | Natural Ring Spun Cotton, 380 GSM | Gray Check Design - 6 Pack",B07QWMR736,False,False,4.7,3247
48,"White Classic Premium Dish Towels for Kitchen, with Hanging Loop [8 Pack] Heavy Duty Absorbent 100% Cotton 410 GSM Terry Kitchen Towels, 16x26 (Multi)",B09LWVBDG4,False,False,4.8,1981
49,"Kitchen Towels, Pack of 12 Bar Mop Towels -16x19 Inches -100% Cotton White Super Absorbent Towels, Multi-Purpose for Home and Bar Cleaning (White)",B08DK17VGB,False,False,4.5,2562
50,"100% Cotton Kitchen Towels Set,Waffle Weave Kitchen Dish Cloth,Super Absorbent Kitchen Dish Towels for Drying Dishes 13x13 Inches Dish Rags for Washing Dishes 6 Pack Mixed Color,Hand Towels",B098QGY4KH,False,False,4.1,425
51,"DII Assorted Woven, Kitchen Dishtowel Set, 18x28, Gray, 5 Piece",B01IZVIBA6,False,False,4.5,3858
52,"100% Cotton Terry Kitchen Towels, 16 x 26 Inches, Checkered Designed, Super Soft and Absorbent Dish Towels for Kitchen Drying, Perfect for Kitchen and Household Cleaning, 4 Pack, Black",B0BML2BFFY,False,False,4.5,521
53,6 Pcs Halloween Kitchen Towels Set Halloween Skeletons Crows Owl Dish Towels Set Vintage Terror Halloween Hand Towel Cooking Baking Tea Towels for Home Bathroom Cooking Baking,B0C8RQHV16,False,False,3.6,46
54,"Fall Pumpkin Sunflower Kitchen Dish Towels Set of 2, Autumn Harvest Flower Gourd Hand Towels Drying Baking Cooking Cloth, Basket Polka Dots Farmhouse Thanksgiving Home Kitchen Decor 18x26 Inch",B0C373NFJL,False,False,4.2,16
55,"Homaxy 100% Cotton Kitchen Towels and Dishcloths Set, 12 x 12 Inches and 13 x 28 Inches, Set of 8 Bulk Kitchen Towels Set, Ultra Soft Absorbent Dish Towels for Washing Dishes, Dark Grey",B0C4YKRHCG,False,False,4.7,33
56,Urban Villa Kitchen Towels (20x30 Inches 6 Pack) Extra Large Premium Dish Towels for Kitchen Blue & White Dish Cloths Highly Absorbent 100% Cotton Kitchen Hand Towels with Hanging Loop Tea Towels,B07MH76WNB,False,False,4.7,8140
57,"Sticky Toffee Cotton Kitchen Towels Dishcloths Set of 8, Gray and White Tea Towels, Reusable and Absorbent Cleaning Cloths, Oeko-Tex Cotton, 12 in x 12 in",B01LX4ZVUJ,False,False,4.6,19115
58,"Homaxy Premium Microfiber Waffle Weave Kitchen Dish Cloths, 12 x 12 Inch Ultra Absorbent and Solid Color Dish Towels for Kitchen Fast Drying Dishcloth for Washing Dishes, 6 Pack, White",B08BZ5QSYR,False,False,4.5,1661
59,Kitchen Towels Dish Towels Tea Towels 100 Percent Cotton Dish Cloths Red and White Dish Towels (15 x 25 Inch) Machine Washable (15),B081V17NCZ,False,False,4.6,1389
