rank,title,id,marked_as_amazon,is_ad,rating,review_count
0,"Ear and Nose Hair Trimmer Clipper - 2021 Professional Painless Eyebrow & Facial Hair Trimmer for Men Women, Battery-Operated Trimmer with IPX7 Waterproof, Dual Edge Blades for Easy Cleansing Black",B098NSHBQK,False,True,4.5,56740.0
1,"Ufree Beard Trimmer for Men, Waterproof Electric Razor Nose Hair Trimmer, Cordless Hair Clippers Shavers for Men, Mustache Body Face Beard Grooming Kit, Gifts for Men Husband Father",B08P4HHSZT,False,True,4.4,9267.0
2,"Ufree Beard Trimmer for Men, Electric Razor for Men, Cordless Hair Clipper Shaving Kit for Mustache Body Nose Ear Hair Facial, Adjustable Beard Grooming Kit Birthday Gifts for Men",B0BMKLJW22,False,True,4.5,1935.0
3,"Remington NE3845A Nose, Ear & Detail Trimmer with CleanBoost Technology, Black",B07D911YDF,False,True,4.2,17729.0
4,"Philips Norelco Nose Trimmer 3000, For Nose, Ears and Eyebrows, Black, NT3600/42",B0842YNRWG,False,False,4.3,24469.0
5,"Ear and Nose Hair Trimmer Clipper - 2021 Professional Painless Eyebrow & Facial Hair Trimmer for Men Women, Battery-Operated Trimmer with IPX7 Waterproof, Dual Edge Blades for Easy Cleansing Black",B098NSHBQK,False,False,4.5,56740.0
6,"Wahl Micro Groomsman Battery Personal Trimmer & Detailer for Hygienic Grooming with Rinseable, Interchangeable Heads for Eyebrows, Neckline, Nose, Ears, & Other Detailing - 05640-600",B003TW70E0,False,False,4.2,38656.0
7,"Remington Remington Virtually Indestructible Nose, Ear & Brow Trimmer, Yellow, NE3871",B0861HTRF3,False,False,4.2,17729.0
8,"Micro Touch MAX Hair Trimmer, Green",B003ZW9LOQ,False,False,4.3,23142.0
9,AREYZIN Ear and Nose Hair Trimmer for Men and Women Professional USB Rechargeable Nose Trimmer Nose Clippers Eyebrow Facial Hair Trimmer Body Grooming Kit IPX7 Waterproof Dual Edge Blades,B092H8XHDG,False,False,4.3,6897.0
10,"PRITECH Beard Trimmer,6 in 1 Kit Electric Hair Trimmers,Cordless Nose Trimmer Mens Grooming Trimmer for Beard Head Face and Body Waterproof IPX7 USB Rechargeable LED Power Display",B08K7H3RNV,False,True,4.4,816.0
11,"PRITECH Hair Trimmer for Women, Waterproof, Rechargeable Pubic Hair Clippers and Bikini Shaver, Electric Razor, Hair Cut Kit, Barber Grooming Set, Aurora Gray",B083TPCMLZ,False,True,4.3,14465.0
12,"Swissklip Nose Hair Trimmer for Men I Manual Nose Hair Trimmer for Women I Stainless Steel Nose Hair Remover for Men & Women I Easy to Use Ear Hair Trimmer I Keep Your Nose Neat and Clean!, 1.0 Count",B0C2DCC73B,False,True,3.9,132.0
13,WAHL All in One LifeProof Cordless Rechargeable Lithium-Ion Hair and Beard Trimmer for Men with Detail Attachment & Ear & Nose Hair Attachment Head – Model 3023803,B0BQ3SNX63,False,True,4.1,143.0
14,"ConairMan Nose Hair Trimmer for Men, For Nose, Ear, and Eyebrows, Patent 360 Bevel Blade for No Pull, No Snag Trimming Experience, Cordless Trimmer 2 piece Set with Detail and Shaver Attachments",B074R3G45B,False,False,4.4,31086.0
15,"Panasonic Men’s Ear and Nose Hair Trimmer, Wet Dry Hypoallergenic Dual Edge Blade - ER-GN30-H",B086RHFJJV,False,False,4.4,9842.0
16,"VG VOGCREST Nose Hair Trimmer for Women & Eyebrow Trimmer, Painless IPX7 Waterproof Rechargeable Nose Trimmer, Easy Cleaning, 2 in 1 Personal Trimmer for Women",B0C5BBC6C8,False,False,4.8,788.0
17,"DELIFO Nose Hair Trimmer, Painless Ear and Nose Hair Trimmer for Men Women Cordless Waterproof Nose Hair Remover Dual Edge Blades Easy Cleansing Eyebrow Trimming Tool",B0BZP5M3KJ,False,False,4.1,175.0
18,"ConairMan Nose Hair Trimmer for Men, For Nose, Ear, and Eyebrows, Patent 360 Bevel Blade for No Pull, No Snag Trimming Experience, Cordless Trimmer 5 piece Set with Professional Metal Handle",B0BHL8TS7F,False,True,4.4,31086.0
19,"Premium Nose & Ear Hair Trimmer Manual for Men and Women, 6 Teeth V Blade Nasal Hair Clippers, Rotary Nose Hair Remover Machine Groom Mate with Clean Brush & Travel Bag",B0CDPXMR3Z,False,True,4.8,29.0
20,"RESUXI Hair Clippers for Men Beard Trimmer Nose Hair Trimmer 3pcs Set,Cordless Professional Barber Clippers for Hair Cutting, Barber Supplies Grooming Kit for Men USB Rechargeable LED Display",B0B5N3ZZBS,False,True,4.5,132.0
21,"[Made in Korea] Hand-made Nose hair trimmer - Nasal Clippers, eyebrow scissors, Nose hair trimmer for men & women, Nose hair Clippers, 316 Surgical-Grade Stainless Steel, Nose hair Scissors (Silver)",B0995ZVQLN,False,True,4.2,288.0
22,"MANSCAPED® Weed Whacker® 2.0 Electric Nose & Ear Hair Trimmer – 7,000 RPM Precision Tool with Rechargeable Battery, Wet/Dry, Easy to Clean, Improved Stainless Steel Replaceable Blade",B0BTJWSGXV,False,False,4.4,1416.0
23,"ConairMAN All-in-One Personal Trimmer for Men, for Nose, Ear, Eyebrows and Sideburns Hair Trimmer, 4 piece Men's Grooming Kit, Lithium Battery-Powered",B08NWZ2MPP,False,False,,
24,"ZORAMI Rechargeable Ear and Nose Hair Trimmer - 2022 Professional Painless Eyebrow & Facial Hair Trimmer for Men Women, Powerful Motor and Dual-Edge Blades for Smoother Cutting, Black",B09WVKHDR2,False,False,4.6,4201.0
25,"Panasonic ER430K Nose, Ear and Facial Hair Trimmer Wet/Dry with Vacuum Cleaning System",B000FYVOJC,False,False,4.3,20473.0
26,"Manual Ear and Nose Hair Trimmer for Men and Women-Allergy-Free, Cool to the Touch, Portable, Small, Waterproof, Battery-Free, with 12 Sharp Blades",B0BX34BQPG,False,False,3.4,18.0
27,"Wahl Men’s Nose Hair Trimmer, for Eyebrows, Neckline, Nose & Ear Hair, Precision Detail Trimming with Interchangeable Heads, Battery Included - Model 5545-400",B002FS4VJQ,False,False,4.2,17208.0
28,"Wahl Groomsman Rechargeable Personal Pen Trimmer & Detailer for Hygienic Grooming with Rinsable, Interchangeable Heads for Eyebrows, Neckline, Nose, Ears, & Other Detailing - Model 3023284",B01MQJ0CRU,False,False,4.3,2131.0
29,"Wahl Lithium Pen Detail Trimmer with Interchangeable Heads for Nose, Ear, Neckline, Eyebrow, & Other Detailing – Rinseable Blades for Hygienic Grooming & Easy Cleaning – Blue – Model 5643-400",B07HXK5J58,False,False,4.1,12044.0
30,"TOUCHBeauty Hair Trimmer for Face Eyebrow Nose Ear Body Hair Trimming, All in ONE Hair Remover for Women & Men Dual Blades Shaver Battery Powered TB-1458",B07D7697X8,False,False,4.0,9627.0
31,"Anvirtue Universal Nose Hair Trimming Tweezers, Stainless Steel Eyebrow Trimmer, Friendly Round Tip, No Mirror Needed Easy Cut, for Noses, Sideburns, Brow, Body (1PC)",B092VGNSNV,False,False,4.2,1387.0
32,"Panasonic ER-GN30-K Nose, Ear n Facial Hair Trimmer Wet/Dry with Vortex Cleaning System, Black",B0041R9NMO,False,False,4.4,43164.0
33,"Rechargeable Ear and Nose Hair Trimmer, Professional Painless Multifunctional Hair Clippers Kit, Beard Trimmer, Body Grooming Kit IPX7 Waterproof, Nose Hair Trimmer for Men and Women, Wet and Dry Use",B0BS5GVDGY,False,False,4.6,448.0
34,"ROYAL [Made in Korea] Gold Nose Hair Trimmer for Men,Golden Birdie, Allergy-Free, Manual, Battery-Free, Waterproof, Painless with Twelve Dual-Edged Blades, Patented Mechanism ET-4PG",B089N7VQCG,False,False,4.3,6234.0
35,"Smity Nose Hair Trimmer, Rechargeable Cordless Painless Ear Eyebrow Trimming Tool Dual Edge Blades Razor Easy Cleansing with LED Light for Man Woman (Black)",B0C4TPD813,False,False,4.8,119.0
36,"Philips Norelco Nose Trimmer 1000, Black, NT1605/60",B0842YLJD9,False,False,3.9,2540.0
37,"Panasonic Ear and Nose Hair Trimmer for Men with Vacuum Cleaning System, Powerful Motor and Dual-Edge Blades for Smoother Cutting, Wet/Dry – ER-GN70-K (Black)",B07TXDYD4L,False,False,4.5,6093.0
38,"XOOMRSCP Nose Hair Trimmer for Men, 2023 Painless USB Rechargeable Nose Hair Trimmer, Ear and Nose Hair Trimmer for Men, Professional Facial Hair Trimmer with IPX7 Waterproof Dual Edge Blades",B0BPXVV4T7,False,False,4.5,577.0
39,"FREHOMEE Manual Nose Hair Trimmer for Man & Woman,No Battery Required,Trimmer for Nose,Ear,Moustache and Whiskers Hair,Waterproof,Stainless Steel with Brush,Allergy-Free,Nasal Clippers",B0BN8XGWD8,False,False,3.8,275.0
40,"ZHIBAI Ear and Nose Hair Trimmer, Painless Nose Hair Clippers Trimmer for Men and Women, Portable Nose Hair Remover with Dual Edge Blades, Battery-Operated, IPX7 Waterproof",B0B7FHSFBQ,False,False,3.5,19.0
41,"Wahl Lithium Battery Powered Lighted Ear, Nose, & Brow Trimmer – Painless Eyebrow & Facial Hair Detail Personal Trimmer – Model 5546-400",B00BCGAOVQ,False,False,4.3,4280.0
42,"Ear and Nose Hair Trimmer with LED Display, Professional Painless USB Rechargeable Nose Trimmer for Men Women, 3 in 1 Lightweight Waterproof Facial Hair Trimmer with IPX7 Waterproof Dual Edge Blades",B0BZVXZVXN,False,False,4.4,144.0
43,"RSAOENF Nose Hair Trimmer for Men and Women, Professional Painless Eyebrow Facial Ear Hair Trimmer Waterproof, Electric Nose Hair Trimmer Wet and Dry Use (Black)",B0CBB7XXLH,False,False,,
44,"Remington Ultimate Precision Detail Trimmer Black NE3160, Black/Gold, 1 Count",B08VXNS6KK,False,False,4.3,2436.0
45,"Aiefeya Nose Hair Trimmer for Men, 2023 Professional Painless Eyebrow & Facial & Nose Hair Trimmer for Men Women, IPX7 Waterproof USB Rechargeable, Easy Cleaning, All-in-ONE Nose Hair Trimmer",B0CGTQB67J,False,False,4.5,20.0
46,"Premium Nose & Ear Hair Trimmer Manual for Men and Women, 6 Teeth V Blade Nasal Hair Clippers, Rotary Nose Hair Remover Machine Groom Mate with Clean Brush & Travel Bag",B0CDPXMR3Z,False,False,4.8,29.0
47,"ToiletTree Products Nose Hair Trimmer with LED Light - Stainless Steel, Heavy-Duty Casing - Ear & Nose Hair Trimmer - Men's Grooming Trimmer for Beard, Eyebrows, and Ears",B00E4PMQAO,False,False,4.3,17773.0
48,"YLYYCC Ear and Nose Hair Trimmer for Men and Women,Professional Painless USB Rechargeable Nose Ear Hair Trimmer,Portable Electric Nose Trimmers Waterproof Dual Edge Blades Nasal Trimmer Nose Clippers",B0C7Z1KMVP,False,False,3.8,66.0
49,"ROYAL [Made in Korea] Premium Nose Hair Trimmer for Men Freikugel, Manual, Battery-Free, Brass & Stainless Steel, Waterproof, Painless with a Patented Mechanism ET-32",B0928HQJQQ,False,False,4.1,3588.0
50,"Rechargeable 2 in 1 Ear and Nose Hair Trimmer for Women, 2023 Professional Painless Eyebrow & Facial Hair Trimmer with Powerful Motor and Dual-Edge Blades Easy Cleansing",B0BFW4HP3K,False,False,4.2,1273.0
51,"AREYZIN Nose Hair Trimmer for Women Ladies Painless Ear and Nose Hair Trimmer Eyebrow Facial Ear Hair Trimmer Nose Hair Clippers Professional, Waterproof, Dual-Edge Blade",B0C64WFVMC,False,False,4.4,59.0
52,LONFANTAR Nose Hair Trimmer for Women and Men，Rechargeable USB Ear and Nose Hair Trimmer，2023 Professional 2 in 1 Painless Washable Facial & Eyebrow Hair Trimmer with Powerful Motor and Low Noise,B0C39ZPVYJ,False,False,4.3,277.0
53,Micro Touch Titanium MAX Lighted Personal Trimmer,B08NWTM5HQ,False,False,4.2,35178.0
54,"Psarnuk Ear and Nose Hair Trimmer Scissors - New Generation Professional Painless Hair Trimmer for Men Women, Portable Manual Stainless Steel Ear and Nose Hair Clipper, Battery-Free, Waterproof",B0C1GGFMJH,False,False,3.5,79.0
55,TIFOR Ear and Nose Hair Trimmer for Men Rechargeable - USB Electric Nose Hair Trimmer for Women - Painless Waterproof Eyebrow Facial Hair Removal Nose Clipper with 2 Extra Replaceable Dual-edge Blades,B09T9CXGB8,False,False,4.2,3324.0
56,"Philips Norelco Multigroomer All-in-One Trimmer Series 3000, 13 Piece Mens Grooming Kit, for Beard, Face, Nose, and Ear Hair Trimmer and Hair Clipper, NO Blade Oil Needed, MG3750/60",B01K1HPA60,False,False,4.5,165763.0
57,"NUMIFUN Nose Hair Trimmer for Women-2023 Professional Painless Rechargeable Nose Trimmer Women Nose Clipper Nasal Hair Trimmer, Powerful Motor, IPX7 Waterproof, Dual Edge Blades",B0C7Z7Q35D,False,False,4.3,1353.0
58,"KAWASAKISEIKI M-7 Nose Hair Trimmer – Multifunctional Nose, Ears and Eyebrows Hair Trimmer for Men with Nickel Sterilized Coating and Self-Cleaning Water Resistant Design – Travel Pouch Included",B00ZZQ90GO,False,False,3.9,469.0
59,"6 PCS Nasal Hair Cutter, 360 Degree Rotating Nose Hair Trimmer, Portable Manual Nose Hair Trimmer for Women and Men",B0CHMDWTYB,False,False,,
