rank,title,id,marked_as_amazon,is_ad,rating,review_count
0,"Amazon Basics Professional Journal, 10.5X7.5 inches, Black, 2-Pack",B07YLTJHH4,True,False,4.7,3366
1,"PAPERAGE Lined Journal Notebook, (Black), 160 Pages, Medium 5.7 inches x 8 inches - 100 gsm Thick Paper, Hardcover",B07L4JCG7T,False,True,4.8,27391
2,"PAPERAGE Lined Spiral Journal Notebook, (Blush), 160 Pages, Medium 5.7 inches x 8 inches - 100 GSM Thick Paper, Hardcover, Double-Wire Spiral Journal & Notebook",B09RG16PP3,False,True,4.7,1155
3,"Black A5 Lined Leather Journal Notebook,Personalized Hardcover Journal Set with Pen & Gift Box,200Pages 100gsm Thick Ruled Paper Daily Diary for Men Women School,Travel,Business,Work,Home Writing",B09F5XQDYJ,False,True,4.7,303
4,"Five Star Spiral Notebook + Study App, 5 Subject, College Ruled Paper, Fights Ink Bleed, Water Resistant Cover, 8-1/2"" x 11"", 200 Sheets, Blue (73635)",B07DPLLXS9,False,False,4.8,26195
5,The Notebook,B003DBOS7Y,False,False,4.8,34187
6,"Five Star Small Spiral Notebook, 2 Subject, College Ruled Paper, 9-1/2"" x 6"", 100 Sheets, Black (72285)",B003OBZFUW,False,False,4.6,3473
7,"Mead Spiral Notebooks, 6 Pack, 1 Subject, College Ruled Paper, 7-1/2"" x 10-1/2"", 70 Sheets per Notebook, Color Will Vary (73065)",B00P9U2EM8,False,False,4.7,14304
8,"Hardcover-Journal-Notebooks, A5 Lined Journals Notebook for Writing 200 Pages, 8.2 x 5.5 inch, Classic Ruled Notebooks for Work/Travel/College (Yellow - 1 Pack)",B0BVG19T6V,False,False,4.7,458
9,"2 Pack College Ruled Notebook, Soft Black Cover Spiral Notebook, Memo Notepad Sketchbook, Students Office Business Diary Spiral Book Journal, 50 Pages, 25 Sheets, 10 x 7.5 Inch",B0C2TFMG1D,False,False,2.4,4
10,"Brown A5 Lined Leather Journal Notebook for Men Women,5.9 X 8.4"" Personalized Hardcover Journal with Pen,200 Pages 100 Gsm Thick Ruled Paper Daily Diary for School,Travel,Business,Work,Home Writing",B0B28NNN7L,False,True,4.6,566
11,"Lined Notebook Journal for Men Women, 368 Pages Thick Journals for Writing, A5 Hardcover Leather Notebook with Pen for Work, Note Taking, School, Daily Diary - College Ruled (5.9''×8.4'')",B0BYVR3Z9Z,False,True,4.7,161
12,"Lined Journal Notebook for Women Men,256 Pages A5 Hardcover Leather Journals for Writing,Travel,Business,Work & School,College Ruled Notebooks for Note Taking, Diary Notepad 5.7""×8.3""(Brown)",B0B4DKQSDV,False,True,4.7,719
13,"RETTACY Large Notebooks College Ruled with 320 Numbered Pages,B5 Lined Journals for Writing with 100GSM Lined Paper,PU Leather,Softcover,Inner Pocket,7.6'' X 10''-GrayBlue",B0B8H3YPRR,False,True,4.7,542
14,"Five Star Spiral Notebook + Study App, 3 Subject, College Ruled Paper, Fights Ink Bleed, Water Resistant Cover, 8-1/2"" x 11"", 150 Sheets, White (72464)",B00JKRKJCS,False,False,4.8,5989
15,The Notebook,B0B8M8B97D,False,False,4.8,34187
16,"Five Star and National Wildlife Federation Spiral Notebook + Study App, 1 Subject, College Ruled Paper, 11"" x 8-1/2"", 80 Sheets, Forest Bear, 1 Count (820088FM)",B0C4FTTYYB,False,False,4.7,36
17,"2 Pack College Ruled Notebook, Soft Yellow Cover Spiral Notebook, Memo Notepad Sketchbook, Students Office Business Diary Spiral Book Journal,100 Pages, 50 Sheets, 7.48 x 5.11 Inch",B09VKM8Q7K,False,False,4.4,667
18,"3 Pack Pocket Notebook Journal - Total 480 Pages Lined Paper, A6 Hardcover Small Notebooks with Pen for Work, Leather Writing Journal for Men Women, 3.7”x 5.7” Mini Notepad & Daily",B0BD4F4NBP,False,True,4.7,505
19,"Lined Journal Notebook, 8.5"" x 11"" Hardcover Leather Notebook for Work, Wide Ruled Notebook Journal for Women Men, 192 Thick Paper, Lay Flat, 2 Pockets, A4 Large Journals for Writing, Black Notebook",B0C3PPLZVJ,False,True,4.8,252
20,"Lined Journal Notebook, 365 Numbered Pages Journals for Writing, B5 Notebooks College Ruled, Hardcover Notebook for Women Men, 5.75"" X 8.38"", Green",B0CC8NMS1N,False,True,4.9,24
21,"RETTACY College Ruled Notebook A5 - Leather Journal Writing Notebook with 192 Numbered Pages,Hardcover,100gsm Thick Paper 5.75'' × 8.38''",B08YMWYQGB,False,True,4.8,747
22,"Spiral Journal/Notebook - Lined Journal with Back Pocket and Hardcover, 8.5"" x 6.4"", College Ruled Notebook/Journal, Premium Thick Paper, Strong Twin-Wire Binding, Perfect for School, Office & Home - Engraved Navy",B0C6X2Z6XY,False,False,4.7,9
23,"Amazon Basics Classic Notebook, Line Ruled, 240 Pages, Black, Hardcover, 5 x 8.25-Inch",B01DN8TCEU,True,False,4.7,53607
24,Aesthetic Spiral Notebook Set of 3 For Women - Cute College Ruled 8x6 Journal/Notebook with Large Pockets And Lined Pages - Perfect Supplies to Stay Organized at Work or School,B0BWYLWWC1,False,False,4.7,207
25,"Spiral Notebook 8.3"" x 6.5"" Subject Notebook with Durable Hardcover and 192 Lined Pages，Journal For Women with Ballpoint Pen and Sticky Note Tabs",B0C7VM38K1,False,False,4.9,25
26,"Spiral Notebook - 3 Pack A5 Lined Journal Notebook, Journals for Women, 6.3"" x 8.3"", 160 Pages, College Ruled Spiral Notebook with Back Pocket, Elastic Closure for Office, School & Home",B0C8HGRT38,False,False,5.0,10
27,"Aesthetic Spiral Notebook Journal For Women - Cute Beige 10.5"" x 8.5"" College Ruled Notebook With Large Pockets And Lined Pages - Perfect to Stay Organized and Boost Productivity at Work or School",B0BSNJJRVJ,False,False,4.7,264
28,Color The Covers College Ruled Composition Notebook: A Blank-lined Journal With Bold Sunflower Design. Great For Students And Adults To Express ... (COLOR THE COVERS Composition Notebooks),B096HXPN98,False,False,4.6,172
29,"EOOUT 3 Pack B5 Spiral Notebook, Hardcover Large Notebooks, Wide Ruled Spiral Notebooks with 160 Pages, 100gsm Paper, 7.3'' x 10.3'' Cute Notebooks for Women Office School Supplies",B0925BVS7C,False,False,4.8,3176
30,"Yansanido Spiral Notebook, 4 Pcs 8.3 Inch x 5.9 Inch A5 Thick Plastic Hardcover 8mm Ruled 4 Color 80 Sheets -160 Pages Journals for Study and Notes (style 10-Wine Red,Brown,Green,ivory, A5)",B08NYRMWZ8,False,False,4.6,1711
31,The Notebook,B0BYQ3Z1H7,False,False,4.8,34187
32,"Aesthetic Spiral Notebook Journal For Women - Cute Dried Floral 10.5"" x 8.5"" College Ruled Notebook With Large Pockets And Lined Pages - Perfect to Stay Organized and Boost Productivity at Work or School",B0BQJ98YT1,False,False,4.8,271
33,"Oxford Spiral Notebook 6 Pack, 1 Subject, Wide Ruled Paper, 8 x 10-1/2 Inch, Blue, Yellow, Red, Light Blue, Green and Black, 70 Sheets (65010)",B0B196BXQK,False,False,4.8,1590
34,"Notebook - 3 Pack A5 Lined Journal Notebooks, 8.3'' x 6'' Spiral Notebook, Journal Notebook with Thick Paper, Classic College Ruled Notebooks for Office, School Supplies",B0BGG8XDLT,False,False,4.8,277
35,"PAPERAGE Lined Journal Notebook, (Black), 160 Pages, Medium 5.7 inches x 8 inches - 100 gsm Thick Paper, Hardcover",B07L4JCG7T,False,False,4.8,27391
36,Notebook,B08KWQKWK8,False,False,4.5,160
37,"Five Star Personal Spiral Notebook, 1 Subject, College Ruled Paper, 7"" x 4-3/8"", Small Size, 100 Sheets, Teal Blue (45484AA4)",B07C47YW78,False,False,4.5,1387
38,"Cambridge Business Notebook, 80 Sheets, Legal Ruled, 8-1/4"" x 11"", Wirebound, Black (06062)",B0000AQONQ,False,False,4.6,2091
39,"C-Line 1 Subject Notebook, 8 x 10-1/2 Inches, Wide Ruled, Yellow, 70 Sheets",B0C7LSXX81,False,False,4.3,4
40,"AHGXG B5 College Ruled Notebook Softcover Journals (2-Pack) Large Composition Notebook 7.6 x 10 inch with Thick 100gsm Lined Paper, Total 408 Numbered Pages, Black Green",B07Z1J4GNZ,False,False,4.8,1978
41,"Mead Spiral Notebook, 6 Pack, 1-Subject, Wide Ruled Paper, 7-1/2"" x 10-1/2"", 70 Sheets per Notebook, Color Will Vary (73063)",B00P9U2EIM,False,False,4.8,5930
42,"A5 Journal Notebook, Leather Ruled Notebooks 160 Pages Diary 100gsm Thick Paper Writing Hardcover Notebook with Pocket for Work Men Woman 8.4 x 5.7 in",B0B9GZMZKR,False,False,4.8,524
43,I'm Trying To Be Awesome Today: Lined notebook,1979636796,False,False,4.7,533
44,"SUNEE 4 Pack Small Notebooks - Mini Spiral Lined Journal 4.13 x 5.8 Inches 8mm Ruled 80 Sheets/160 Pages - Journals for Study and Notes (pink, blue, green, purple)",B0BXP9R9SX,False,False,4.7,615
45,"Spiral Notebook - 4 Pack Spiral Notebook, 5.6'' x 8.25'', 80 Sheets / 160 Pages Per Notebook, Spiral Notebook with Twin-Wire Binding, Journals for Women, College Ruled Notebooks with 4 Colors",B0C283DPV7,False,False,4.7,109
46,"2Pack College Ruled Wirebound Spiral Notebook, College Ruled Notebook, 100 Pages, 50 Sheets, 7.48 x 5.11 Inch, Black and Yellow Cover",B09VKCZY4Z,False,False,4.2,145
47,The Notebook,B000Q67J66,False,False,4.6,11709
48,"Spiral Notebook Journal 8.5” x 11”, A4 Large Pink Notebooks for Women Men, College Ruled Lined Journal, 100 GSM Paper, Plastic Hardcover Spiral Bound Journals for Work School Note Taking Business",B0C995MCSX,False,False,4.4,51
49,"Spiral Notebook Journal 8.5” x 11”, 300 Pages Hardcover Leather Lined Journals for Women Men, A4 Large College Ruled Notebooks with 100 GSM Thick Paper, Spiral Journal for Writing Work School, Pink",B0C9C5RPQ6,False,False,4.8,42
50,"AISBUGUR Pocket Notebook Small Notebook 2-Pack, 3.7"" x 5.7"" pocket notebook hardcover Total 320 Pages Thick Lined Paper with Inner Pockets Leather Mini Journal Notepad",B0878Y5TVR,False,False,4.7,5255
51,The Notebook,B0BNB1NSC2,False,False,4.6,229
52,"CAGIE Lined Journal Notebook for Work, 196 Pages, Medium 5.7"" x 8.3"", Hardcover Notebook Journal with Pen Loop, (Black Ruled)",B0967ZVMPK,False,False,4.7,2206
53,"Five Star Spiral Notebook + Study App, 5 Subject, College Ruled Paper, Advance Notebook with Spiral Guard, Movable Tabbed Dividers and Expanding Pockets, 8-1/2"" x 11"", 200 Sheets, Black (73144)",B00X7X2KIC,False,False,4.8,12508
54,"EMSHOI A4 Spiral Notebook College Ruled Lined Journal, 11.2"" X 8.27"", 300 Pages/150 Sheets, 100gsm Thick Paper, Waterproof Softcover, Twin-Wire Binding, for School Work Business Writing-Blue",B09T9J2164,False,False,4.7,407
55,"Oxford Spiral Notebook 6 Pack, 1 Subject, College Ruled Paper, 8 x 10-1/2 Inch, Pastel Pink, Orange, Yellow, Green, Blue and Purple, 70 Sheets (63756)",B08VF9B772,False,False,4.8,5886
56,"Lined Spiral Journal Notebook with 300 Numbered Pages, B5 College Ruled Thick Journals for Writing with 100GSM Paper, Hardcover Notebooks with Contents for Work, School, Women, Men, Pink",B0BPB5DKMR,False,False,4.8,287
57,"Thick Classic Notebook with Pen Loop - Lemome A5 College Ruled Hardcover Writing Notebook with Pocket + Page Dividers Gifts, Banded, Large, 180 Pages, 8.4 x 5.7 in",B01NAT49WS,False,False,4.8,21364
58,"B5 Spiral Notebook Lined, Spiral Ruled Journal with Hard Kraft Cover, 70 Sheets (140 Pages), 10.3"" x 7.2"", 3-Pack, Blue",B07V4DB2ZL,False,False,4.6,1834
59,"Lined Journal Notebook, Ruled Notebook for Work, Hardcover 120Gsm Premium Thick Paper with Faux Leather Notebook for Journaling Writing Office School Supplies 5.25""×8.25"" (1,Matte Black)",B07DCSJ35B,False,False,4.7,5730
