rank,title,id,marked_as_amazon,is_ad,rating,review_count
0,"Olaplex No. 3, 8.5 Fl Oz",B0872RL24B,False,True,4.6,1240
1,Olaplex No. 8 Bond Intense Moisture Mask,B092DNPHC9,False,True,4.7,10493
2,"Olaplex No. 4 Bond Maintenance Shampoo, 1L",B0BDBL9LVF,False,True,4.8,632
3,"Olaplex No. 4P Blonde Enhancing Toning Shampoo, 8.5 Fl Oz",B09FYK7FKR,False,True,4.6,6684
4,Olaplex No. 5 Bond Maintenance Conditioner,B07D37SBHF,False,False,4.6,65498
5,Olaplex No. 4 Bond Maintenance Shampoo,B07D37PQGL,False,False,4.7,67568
6,"Olaplex No.7 Bonding Oil, 30 ml",B07VR1NDSQ,False,False,4.7,43037
7,"Olaplex No 6 Bond Smoother, 3.3 Fl Oz",B07PW4MTHV,False,False,4.7,45223
8,Olaplex Hair Perfector No 3 Repairing Treatment,B00SNM5US4,False,False,4.6,120761
9,Olaplex Strong Days Ahead Hair Kit,B0CF2SMSFM,False,False,4.8,18
10,"Olaplex No.0 Intensive Bond Building Treatment, White, 5.2 Fl Oz",B08HTNRZMH,False,True,4.5,17756
11,Olaplex Strong Start Hair Kit: Repair & Style,B0C442QKW9,False,False,4.5,345
12,Olaplex No. 8 Bond Intense Moisture Mask,B092DNPHC9,False,False,4.7,10493
13,"Olaplex No.0 Intensive Bond Building Treatment, White, 5.2 Fl Oz",B08HTNRZMH,False,False,4.5,17756
14,"Olaplex No. 5 Bond Maintenance Conditioner, 1L",B0BDBRK1B6,False,False,4.8,570
15,"Olaplex No. 5 Bond Maintenance Conditioner, 1L",B0BDBRK1B6,False,True,4.8,570
16,Olaplex No. 4D Clean Volume Detox Dry Shampoo,B0BTWR89FV,False,True,4.3,200
17,Olaplex No. 4 Bond Maintenance Shampoo,B07D37PQGL,False,True,4.7,67568
18,Bonding Shampoo & Conditioner Set for Damaged Hair Repair | Acidic Bonding Concentrate | Sulfate-Free | Repairs Bleached or Color-Treated Hair | For All Hair Types,B08W7LW8RQ,False,True,4.6,2687
19,"Olaplex No. 4P Blonde Enhancing Toning Shampoo, 8.5 Fl Oz",B09FYK7FKR,False,False,4.6,6684
20,"Olaplex No. 4 Bond Maintenance Shampoo, 1L",B0BDBL9LVF,False,False,4.8,632
21,"Olaplex No. 3, 8.5 Fl Oz",B0872RL24B,False,False,4.6,1240
22,Olaplex Volumizing Blow Dry Mist,B0C6VQBFTC,False,False,4.3,104
23,Volumizing Biotin Shampoo and Conditioner Set - Sulfate Free Shampoo and Conditioner for Dry Damaged Hair Care - Thinning Hair Shampoo and Conditioner with Nourishing Biotin and Rosemary Oil (8oz),B07FSMRY3S,False,True,4.3,19720
24,Bonding Shampoo for Damaged Hair Repair | Strengthens and Repairs Weak and Brittle Hair | Acidic Bonding Concentrate | Safe for Color-Treated Hair | For All Hair Types,B08P66Q9TK,False,True,4.4,9807
25,Joico Defy Damage Sleepover Overnight Nourishing Treatment | Instantly Softens & Smooths | Strengthen Bonds | Reduce Breakage & Split Ends | No Rinse Formula | With Arginine & Keratin | 3.38 Fl Oz,B08YMH2JZK,False,True,4.5,485
26,"Olaplex No. 4C Bond Maintenance Clarifying Shampoo, 250 milliliters",B0B4BG3HPM,False,False,4.6,908
27,Olaplex No. 5P Blonde Enhancer™ Toning Conditioner 250ml,B0CGFYR4JQ,False,False,4.6,17
28,Olaplex Unbreakable Blondes Mini Kit,B0BWQ24RFK,False,False,4.4,115
29,"Olaplex Lashbond Building Serum, 4.5 ml. Clear",B0BV7KR7WY,False,False,4.1,121
30,Olaplex Ultimate Bond Treatment System,B096LNNH6B,False,False,4.5,393
31,Olaplex No. 4D Clean Volume Detox Dry Shampoo,B0BTWR89FV,False,False,4.3,200
32,Olaplex No. 9 Bond Protector Nourishing Hair Serum,B09XBZMG71,False,False,4.6,3577
33,Elizavecca cer-100 collagen coating hair protein treatment 100ml,B01I2ZQJSG,False,False,4.4,45185
34,Complete Hair Repair System,B09DKMX8VD,False,False,4.6,436
35,COLOR WOW Dream Coat Supernatural Spray – Multi award winning anti frizz spray keeps hair frizz free for days no matter the weather with moisture repellant anti humidity technology; glass hair results,B073CWSQ51,False,False,4.3,66993
36,"K18 Leave-In Repair Hair Mask Treatment to Repair Dry or Damaged Hair - 4 Minutes to Reverse Hair Damage from Bleach, Color, Chemical Services and Heat",B09HR5KSR8,False,False,4.3,11531
37,"Pre Wash Hair Oil, Hair Growth Oil, Hair Oil for Gry Damaged Hair and Growth, Scalp Oil, Nourish & Repair for All Hair Types, Dry, and Itchy Scalp(1.7 Fl Oz / 50 ml)",B0C47LD69V,False,False,4.6,43
38,"BoldPlex 3 Hair Mask - Deep Conditioner Protein Treatment for Dry, Damaged Hair - Conditioning Moisturizer Products for Curly, Bleached, or Frizzy Hair - Vegan & Cruelty Free - 6.76 Fl Oz",B0888NTP6Y,False,False,4.4,22855
39,"OUAI Hair Oil - Hair Heat Protectant Oil for Frizz Control - Adds Hair Shine and Smooths Split Ends - Color Safe Formula - Paraben, Phthalate and Sulfate Free (0.45 oz)",B0C2PPB5YZ,False,False,4.6,3211
40,"Bonding Hair Mask for Dry, Damaged Hair Repair | Acidic Bonding Concentrate | Hydrating 5 Minute Hair Mask | For All Hair Types",B0C8WL48DR,False,False,4.5,69
41,"Glaze Sheer Glow Transparent Clear Conditioning Super Gloss 6.4 fl.oz (2-3 Hair Treatments) Award Winning Hair Gloss Treatment. No mix, no mess hair mask - guaranteed results in 10 minutes",B0B1VJFGDW,False,False,3.6,5508
42,"OUAI Leave In Conditioner - Multitasking Heat Protectant Spray for Hair - Prime Hair for Style, Smooth Flyaways, Add Shine and Use as Detangling Spray - No Parabens, Sulfates or Phthalates (4.7 oz)",B07B895KND,False,False,4.6,9691
43,"MONDAY HAIRCARE Moisture Shampoo + Conditioner Set for Dry, Coarse, Stressed, Coily & Curly Hair, Made from Coconut Oil, Rice Protein, Shea Butter, & Vitamin E, All-Natural, 12 Fl Oz (Pack of 2)",B0B941XTDZ,False,False,4.2,1496
44,"Nexxus Shampoo and Conditioner Therappe Humectress 2 Count for Dry Hair Silicone-Free, Moisturizing Caviar Complex and Elastin Protein 33.8 oz",B00C5AHTVQ,False,False,4.7,15973
45,"Moroccanoil Intense Smoothing Frizz Control Serum, 1.7 Fl. Oz.",B0CCK1XL7Q,False,False,4.6,46
46,Nexxus Humectress Moisturizing Conditioner Ultimate Moisture for Dry Hair Moisturizing ProteinFusion with Elastin Protein and Green Caviar 33.8 oz,B000GFZWE8,False,False,4.7,7595
47,"100ML Ordinary-Glycolic Acid 7% Toning Resurfacing,Glycolic Sour 7% Toner, Solution for Blemishes and Acne（1）",B0C65LFWXB,False,False,3.0,273
48,Bonding Treatment for Damaged Hair Repair | Acidic Bonding Concentrate | Intensive Bonding Pre-Shampoo Hair Treatment | For Colored Hair & All Hair Types,B09QYD97XY,False,False,4.4,2173
49,The Blonde Mainteance System,B09VV2FS3R,False,False,4.6,269
50,"YFONG 3 Pack Large Microfiber Hair Towel Wrap, 30"" x 10"" Anti Frizz Quick Dry Hair Towels for Women Long, Curly, Thick Hair, Super Absorbent Hair Turban for Wet Hair (Grey, White, Camel)",B0C1N1M8NK,False,False,4.7,117
51,"XYMOGEN OSAplex - Clinically Tested Microcrystalline Hydroxyapatite Concentrate MCHC, Calcium + Vitamin D3 - Supports Bone Collagen Formation, Bone Mineral Density + Strength (60 Packets)",B008QCYPHI,False,False,5.0,4
52,"IPL Laser Hair Removal for Women and Men, At-home Permanent Hair Removal Device 999999 Flashes Hair Remover for Whole Body Use",B0BXRY5TYT,False,False,4.0,44
53,"K18 Molecular Repair Hair Oil - Weightless Oil Strengthens, Repairs Damage, Reduces Frizz, Improves Shine For All Hair Types - 30ml",B0BYT7QCFB,False,False,4.3,322
54,"K18 PEPTIDE PREP™ Color-Safe Detox Clarifying Shampoo - Non-Stripping, pH-Optimized Cleanse Removes Product Buildup, Dirt, Oils, Metals, 8.5 fl oz",B0B4DXHCRR,False,False,4.6,445
55,Bonding Shampoo & Conditioner Set for Damaged Hair Repair | Acidic Bonding Concentrate | Sulfate-Free | Repairs Bleached or Color-Treated Hair | For All Hair Types,B08W7LW8RQ,False,False,4.6,2687
56,"OUAI Detox Shampoo - Clarifying Shampoo for Build Up, Dirt, Oil, Product and Hard Water - Apple Cider Vinegar & Keratin for Clean, Refreshed Hair - Sulfate-Free Hair Care (10 oz)",B084C2PC69,False,False,4.6,3649
57,"Mielle Organics Rosemary Mint Scalp & Hair Strengthening Oil With Biotin & Essential Oils, Nourishing Treatment for Split Ends and Dry Scalp for All Hair Types, 2-Fluid Ounces",B07N7PK9QK,False,False,4.6,60995
58,"Boldplex 3, 4 & 5 Bond Restore Treatment, Shampoo & Conditioner Trio Gift Set - Hydrating Protein Formula, Strengthens Dry & Damaged Hair, Repairs Breakages & Split Ends. Vegan & Cruelty Free.",B09XQXJVHC,False,False,4.4,953
59,"Briogeo Curl Charisma Curl Cream, Anti Frizz Hair Styling Products for Curly Hair, Curl Creme Moisturizer for Wavy Hair, 2 oz",B0CCJZNP6P,False,False,4.3,2154
