rank,title,id,marked_as_amazon,is_ad,rating,review_count
0,"Maui Moisture Heal & Hydrate + Shea Butter Shampoo + Conditioner to Repair & Deeply Moisturize Tight Curly Hair with Coconut & Macademia Oils, Vegan, Silicone, Paraben & Sulfate-Free, 13 Fl Oz",B09PJ4TC8Y,False,True,4.5,1054
1,"Pantene Shampoo, Conditioner and Hair Treatment Set, Daily Moisture Renewal for Dry Hair, Safe for Color-Treated Hair",B09GV3RGW2,False,True,4.7,3069
2,"Argan Oil Shampoo and Conditioner Set - Sulfate-Free Formula with Nourishing Moroccan Oil and Keratin -for All Hair, Curly or Straight - Hydrate Repair and Defy Frizz for Salon-like Results! (16 Fl Oz (Pack of 2))",B01BFKIJ06,False,True,4.3,12141
3,"Maui Moisture Lightweight Hydration + Hibiscus Shampoo + Conditioner for Daily Moisture, No Sulfates, 13 Fl Oz",B09PJ5YH75,False,True,4.5,5903
4,"L’Oréal Paris Elvive Total Repair 5 Repairing Shampoo and Conditioner for Damaged Hair, 28 Ounce (Set of 2)",B0842YG95G,False,False,4.6,31332
5,"MONDAY HAIRCARE Gentle Shampoo + Conditioner Set (2 Pack) 12oz Each for Normal to Delicate Hair Types, Made from Coconut Oil, Rice Protein, & Vitamin E, 100% Recyclable Bottles",B0B9422HBP,False,False,4.3,1515
6,"Aussie Total Miracle Shampoo, Conditioner and 3 Minute Miracle Deep Conditioner Hair Treatment Bundle, Infused with Apricot and Australian Macadamia Oil, Paraben Free",B0857LKWKY,False,False,4.7,5556
7,"OGX Nourishing + Coconut Milk Shampoo & Conditioner Set, 13 Fl Oz (Pack of 2) (packaging may vary), White",B078K4SVCH,False,False,4.5,4115
8,"MONDAY HAIRCARE Moisture Shampoo + Conditioner Set for Dry, Coarse, Stressed, Coily & Curly Hair, Made from Coconut Oil, Rice Protein, Shea Butter, & Vitamin E, All-Natural, 12 Fl Oz (Pack of 2)",B0B941XTDZ,False,False,4.2,1496
9,BIOSILK Silk Therapy Duo Set Shampoo and Conditioner - 12 Fl Oz (Pack of 2),B004J0RHTO,False,False,4.5,9465
10,Biolage Ultra Hydra Source Shampoo & Conditioner Set | Anti-Frizz Deep Conditioner Renews Hair's Moisture | For Very Dry Hair | Silicone-Free | Vegan,B091V8JN2Q,False,True,4.7,3015
11,"Pantene Sulfate Free Shampoo and Conditioner Set, Rose Water, Soothing and Moisturizing, Nutrient Infused with Vitamin B5, for all Hair Types, Safe for Color Treated Hair,Pro-V Blends, 17.9 oz,2-Count",B07N3BN1KS,False,True,4.5,9152
12,"Herbal Essences Shampoo and Conditioner Set Repairing Argan Oil of Morocco with Natural Source Ingredients, Color Safe, BioRenew, 20.2 Fl Oz, 2 Count",B07NQ69L7P,False,True,4.6,19589
13,"OUAI Medium Shampoo + Conditioner Set - Nourishes with Babassu and Coconut Oils, Strengthens with Keratin & Adds Shine with Kumquat Extract - Free of Parabens, Sulfates & Phthalates - 10 fl oz Each",B08SYKL11M,False,True,4.4,2353
14,"L'Oreal Paris Elvive Dream Lengths Shampoo and Conditioner Kit, Paraben Free, 1 kit",B08D7J83PZ,False,False,4.6,16291
15,"Argan Oil Shampoo and Conditioner Set - Sulfate-Free Formula with Nourishing Moroccan Oil and Keratin -for All Hair, Curly or Straight - Hydrate Repair and Defy Frizz for Salon-like Results! (16 Fl Oz (Pack of 2))",B01BFKIJ06,False,False,4.3,12141
16,"Aussie Miracle Moist Shampoo, and 3 Minute Miracle Deep Conditioner Hair Treatment Bundle, Infused with Avocado & Australian Jojoba Oil, Paraben Free, White, Citrus, 3 Piece Set",B0857LTYZ2,False,False,4.7,8819
17,"Pantene Shampoo, Conditioner and Hair Treatment Set, Daily Moisture Renewal for Dry Hair, Safe for Color-Treated Hair",B09GV3RGW2,False,False,4.7,3069
18,Luseta B-Complex Shampoo & Conditioner Set for Hair Growth and Strengthener - Hair Loss Treatment for Thinning Hair With Biotin Caffein and Argan Oil for Men & Women - All Hair Types 2 x 16.9oz,B07YYTLFK6,False,True,4.4,12567
19,"Luseta Apple Cider Vinegar Shampoo and Conditioner for Hair Loss,Clarifying, Dandruff - Sulfate Free, for Damaged and Oily Hair Types, Men and Women - 2 x 16.9oz",B07CSMBW3J,False,True,4.3,1784
20,Purezero Volumizing Shampoo and Conditioner Set - For Fine Hair - Add Volume & Body - Zero Sulfates/Parabens/Dyes -100% Vegan & Cruelty Free - Great For Color Treated Hair,B09SVYLSWQ,False,True,3.8,74
21,"OGX Ever Straightening + Brazilian Keratin Therapy Shampoo, for Lustrous, Shiny Hair, Paraben-Free, Sulfate-Free Surfactants, Coconut Oil, Keratin powder,Avocado oil and cocoa butter, 13 Fl Oz",B004ISW5YY,False,True,4.5,8221
22,"Garnier Fructis Sleek & Shine Shampoo (22 Fl Oz) + Conditioner (21 Fl Oz) Set for Frizzy, Dry Hair, Plant Keratin + Argan Oil (2 Items), 1 Kit (Packaging May Vary)",B07PDM4HPL,False,False,4.7,7174
23,"Kristin Ess Hydrating Signature Sulfate Free Salon Shampoo and Conditioner Set for Moisture, Softness + Shine - Avocado Oil - Anti Frizz + Clarifying - Vegan + Safe for Color Treated Dry Damaged Hair",B0B9T85DHH,False,False,4.4,1588
24,"Aveeno Fresh Greens Shampoo + Conditioner with Rosemary, Peppermint & Cucumber to Thicken & Nourish, Clarifying & Volumizing Shampoo for Thin or Fine Hair, Paraben-Free, 12 Fl Oz",B09PJ4HWCP,False,False,4.5,7861
25,"Tea Tree Shampoo and Conditioner Set, Biotin Shampoo Rich Tea Tree Oil,Conditioning Rosemary, Hair Thickening Shampoo for All Hair Types, Refreshes Scalp, Sulfate & Paraben Free",B0BVQG5LBR,False,False,3.9,10
26,Bed Head by TIGI Urban Antidotes Recovery Shampoo and Conditioner for Dry Hair 25.36 fl oz 2 count,B003T1G0XI,False,False,4.6,8008
27,"Herbal Essences Shampoo and Conditioner Set for Dry Hair with Coconut Water and Jasmine, 29.2 Fl Oz",B09GTN5243,False,False,4.7,1266
28,"OGX Nourishing + Coconut Milk Shampoo & Conditioner, Set, 25.4 Fl Oz (Pack of 2)",B07RJBKPH1,False,False,4.6,3396
29,"PURA D'OR Anti-Thinning Biotin Shampoo and Conditioner Natural Earthy Scent,Clinically Tested Proven Results DHT Blocker Thickening Products For Women & Men,Original Gold Label Hair Care Set 16oz x2",B07BHCB9Y2,False,False,4.3,25719
30,"Herbal Essences Shampoo and Conditioner Set Repairing Argan Oil of Morocco with Natural Source Ingredients, Color Safe, BioRenew, 20.2 Fl Oz, 2 Count",B07NQ69L7P,False,False,4.6,19589
31,"Maui Moisture Curl Quench + Coconut Oil Shampoo + Conditioner to Hydrate and Detangle Tight Curly Hair, Softening Shampoo, Vegan, Silicone & Paraben-Free, 13 Fl Oz",B09PJ47CQN,False,False,4.6,4959
32,"Dove Nutritive Solutions Daily Moisture, Shampoo and Conditioner Duo Set, 40 Ounce Pump Bottles",B01BMQ2BLQ,False,False,4.7,3287
33,"L'Oreal Paris Elvive Color Vibrancy Protecting Shampoo and Conditioner Set for Color Treated Hair, 28 Fl Oz (Set of 2)",B091G4XWP3,False,False,4.6,3669
34,"Not Your Mother's Naturals Shampoo and Conditioner Sets - 2-Pack - Naturally Occurring Ingredients, Sulfate-Free Shampoo and Conditioner for All Hair Types (Curl Definition)",B07KQ24CZS,False,False,4.2,5170
35,"MONDAY HAIRCARE Volume Shampoo + Conditioner Set (2 Pack) 12oz Each for Thin, Fine, and Oily Hair, Made from Coconut Oil, Ginger Extract, & Vitamin E, 100% Recyclable Bottles",B0B941W753,False,False,4.1,1310
36,"Dove Advanced Hair Series Oxygen Moisture, Shampoo and Conditioner Set, 12 Ounce Each",B00JFL5ZBE,False,False,4.6,963
37,Biotin Shampoo and Conditioner Set - Sulfate and Paraben Free Treatment for Men and Women - Hair Thickening Volumizing Products to Help Boost Thinning Hair with Added Keratin,B07K4S4J66,False,False,4.3,26471
38,TRESemme Moisture Rich Shampoo & Conditioner Value Pack,B01M1NGVS9,False,False,4.5,2693
39,"L'Oréal Paris EverPure Moisture Sulfate Free Shampoo and Conditioner for Color-Treated Hair, 8.5 Ounce (Set of 2)",B07QC43BXB,False,False,4.5,13192
40,"Argan Oil Shampoo and Conditioner Set - Moisturizing Sulfate Free Moroccan Care with Keratin - For Curly, Straight, Dry and Damaged Hair - Hydrating, Anti Frizz Salon Technology",B06Y2DT2GJ,False,False,4.5,21262
41,"Aussie Total Miracle Collection 7n1 Shampoo and Conditioner Set, 12.1 Fluid Ounce Each",B00X1ME00U,False,False,4.6,2582
42,"Pantene Shampoo 27.7oz, Conditioner 25.1 oz and Hair Treatment 0.5 oz Set, Smooth and Sleek for 72+ Hours of Lasting Frizz Control, Safe for Color-Treated Hair",B09GTW4VLH,False,False,4.7,1202
43,"Garnier Whole Blends Honey Treasures Repairing Shampoo and Conditioner Set for Dry, Damaged Hair, 22 Fl Oz (2 Items), 1 Kit (Packaging May Vary)",B07PCX6PLB,False,False,4.7,6149
44,"Nexxus Shampoo and Conditioner Therappe Humectress 2 Count for Dry Hair Silicone-Free, Moisturizing Caviar Complex and Elastin Protein 33.8 oz",B00C5AHTVQ,False,False,4.7,15973
45,"Love Beauty and Planet Volume and Bounty Thickening Shampoo and Conditioner Coconut Water & Mimosa Flower, 2 count For Hair Volume and Fine Hair Care Paraben Free, Silicone Free, and Vegan 13.5 oz",B0784NY92P,False,False,4.4,8905
46,"Native Vegan Cucumber & Mint Natural Volume Shampoo & Conditioner Set, Clean, Sulfate, Paraben and Silicone Free - 16.5 fl oz Each, 2, 33.0 Ounce",B0B8MP3RM3,False,False,4.6,195
47,Bed Head by TIGI Urban Antidotes Resurrection Shampoo and Conditioner for Damaged Hair 25.36 fl oz 2 count,B003T18TE6,False,False,4.6,12775
48,All Soft Shampoo & Conditioner Set | For Dry/Brittle Hair | Provides Intense Softness and Shine | With Argan Oil,B094F6TRCF,False,False,4.7,3797
49,Luseta B-Complex Shampoo & Conditioner Set for Hair Growth and Strengthener - Hair Loss Treatment for Thinning Hair With Biotin Caffein and Argan Oil for Men & Women - All Hair Types 2 x 16.9oz,B07YYTLFK6,False,False,4.4,12567
50,L’Oréal Paris Elvive Extraordinary Clay Rebalancing Shampoo and Conditioner Set (Set of 2),B092MYHYY2,False,False,4.6,3040
51,"Aussie Kids Shampoo, Conditioner, and Detangler Bundle, Sulfate Free and Paraben Free, Shampoo and Conditioner 16 fl oz each, Spray 8 fl oz",B09GTMR23B,False,False,4.7,2245
52,"Herbal Essences, Volume Shampoo & Conditioner Kit with Natural Source Ingredients, For Fine Hair, Color Safe, Bio Renew White Grapefruit & Mosa Mint Naked Volume, 20.2 fl oz, Kit",B079TH68RF,False,False,4.6,4756
53,"Shea Moisture Shampoo and Conditioner Set, Coconut & Hibiscus Curl & Shine, Curly Hair Products with Coconut Oil, Vitamin E & Neem Oil, Frizz Control, Family Size, 16 Fl Oz Ea",B0713PYLJS,False,False,4.5,7807
54,"TRESemme Shampoo and Conditioner Set, Silky & Smooth, Argan Oil with Vitamin E, Anti Frizz Hair Products, 28 Fl Oz each",B014NC3E3A,False,False,4.6,2129
55,"Peppermint Rosemary Hair Regrowth and Anti Hair Loss Shampoo and Conditioner Set - Daily Hydrating, Detoxifying, Volumizing Shampoo and Fights Dandruff For Men and Women 16 fl oz x 2",B08P1V2SG4,False,False,4.1,4644
56,"TRESemmé Flawless Curls Shampoo and Conditioner Set, Curly Hair Products with Coconut Oil Leaves Curls Defined, Sulfate Free, Frizz Free, 28 Fl Oz Ea",B01DMOX8N6,False,False,4.6,3014
57,It's A 10 Miracle Shampoo Plus Keratin 10 Oz & Miracle Deep Conditioner Plus Keratin 5 Oz Duo,B00GWWZ2ZI,False,False,4.6,1412
58,Bed Head by TIGI Urban Antidotes Re-Energize Daily Shampoo and Conditioner 25.36 fl oz 2 count,B003T1CQDQ,False,False,4.6,5628
59,"Suave Professionals Damage Repair Shampoo + Conditioner Coconut Oil, 28 Fl Oz (Pack of 4)",B06XMXRX45,False,False,4.5,989
